5000320,"John Vena, Inc.",2014-10-28 08:20:07,10/28/2014 8:38:15 AM,,Pennsylvania,42,Philadelphia,6700 Essington Avenue,19153,John Vena,President,marketing@johnvenaproduce.com,2153360766,http://www.johnvenaproduce.com/,https://www.facebook.com/JohnVenaProduce,https://twitter.com/JohnVenaProduce,Pennsylvania,42,Philadelphia,101,6700 Essington Avenue,Philadelphia,19153,On Essington Avenue across from the auto mall. Four miles from the Philadelphia International Airport.,1919,6,C Corp,Year Round;,1,1,1,1,1,1,1,1,1,1,1,1,2,,"Canned, preserved fruits/vegetables; Cut flowers; Dry beans; Fresh/dried herbs; Fresh fruits; Fresh vegetables; Juices/non-alcoholic ciders; Mushrooms; Wild harvested forest products; ",0,1,0,1,0,1,0,0,1,1,1,0,0,0,1,0,1,0,0,0,0,0,0,1,0,,,"Canned, preserved fruits/vegetables; Cut flowers; Dry beans; Fresh/dried herbs; Fresh fruits; Fresh vegetables; Juices/non-alcoholic ciders; Mushrooms; Wild harvested forest products; ",,,3,,3,,3,,,3,3,3,,,,3,,3,,,,,,,3,,,0,0,0,0,0,0,0,0,0,0,0,0,0,0,,0,0,0,0,0,0,0,0,0,0,0,0,0,0,,0,0,0,0,0,0,0,,0,0,,0,0,0,0,0,0,0,0,0,0,,0,0,0,0,0,0,0,0,0,,0,0,0,0,0,0,0,0,0,0,0,0,0
5000126,La Montanita Distribution Center,,2014-08-26 11:31:22,2014-08-26 11:31:22,New Mexico,35,Albuquerque,901 Menaul NE,87107,Michelle Franklin,La Montanita Distribution Manager,mf@lamontanita.coop,505-217-2010,http://www.lamontanita.coop/,https://www.facebook.com/lamontanitacoopmarket,,New Mexico,35,Bernalillo,001,904 Menaul NE,Albuquerque,87107,1 mile west of I-25,2007,3,Consumer Cooperative,Year Round;,1,1,1,1,1,1,1,1,1,1,1,1,1,,"Canned, preserved fruits/vegetables; Dry beans; Eggs; Fresh/dried herbs; Fresh fruits; Fresh vegetables; Grains/flour; Honey; Juices/non-alcoholic ciders; Maple products; Nuts; Pet food; Poultry/fowl meat/products; Red/non-poultry meat/products; ",0,1,0,0,0,1,1,0,1,1,1,1,0,1,1,1,0,1,1,1,1,0,0,0,0,Dry beans; Fresh/dried herbs; Fresh fruits; Fresh vegetables; Honey; Juices/non-alcoholic ciders; Nuts; Pet food; Red/non-poultry meat/products; ,,"Canned, preserved fruits/vegetables; Eggs; Grains/flour; Poultry/fowl meat/products; ",Maple products; ,,3,,,,1,3,,1,1,1,3,,1,1,4,,1,1,3,1,,,,,"USDA Certified Organic; Non-Certified, but Practicing Organic; Free Range/Pasture Raised; Grass Fed; Antibiotic Free; ",1,0,0,1,1,1,1,0,0,0,0,0,0,0,"Small independent grocery stores; Corner stores, bodegas; Food retail cooperatives; Restaurants; Distributors; Pre-K food service; K-12 school food service; Colleges/Universities; Hospitals; ",0,1,1,1,1,0,1,0,1,1,1,1,0,0,,0,0,0,0,0,0,0,We take ownership of the products and resell to customers; We sell on a consignment basis and take a commission on products sold; ,1,1,Aggregation; Distribution services; Brokering services; Product storage; ,1,0,1,1,0,0,1,0,0,0,Marketing and promotional services; Branding/labeling products to indicate origin of product; Production and post-harvest handling training; Business management services or guidance; Food safety and/or GAP Training; Transportation services; ,1,1,0,1,1,0,1,0,1,Food donation to local food pantries/banks; ,0,0,0,0,0,0,0,0,0,0,0,0,1
5000332,Lake-to-River Food Hub,2014-12-30 10:10:41,2014-12-30 10:37:41,2014-12-30 10:37:41,Ohio,39,Youngstown,1221 Elm Street,44505,Melissa Miller,Manager,info@laketoriver.org,3303600648,https://www.localfoodmarketplace.com/laketoriver/,,,Ohio,39,Mahoning,099,901 Elm Street,Youngstown,44505,Pick up location inside the Common Wealth Kitchen Incubator.,2011,1,Non-Profit,Year Round;,1,1,1,1,1,1,1,1,1,1,1,1,2,,"Baked goods; Canned, preserved fruits/vegetables; Coffee/tea; Dairy products; Dry beans; Eggs; Fresh/dried herbs; Fresh fruits; Fresh vegetables; Grains/flour; Honey; Juices/non-alcoholic ciders; Maple products; Nuts; Poultry/fowl meat/products; Red/non-poultry meat/products; Soap/body care products; ",1,1,1,0,1,1,1,0,1,1,1,1,0,1,1,1,0,1,0,1,1,1,0,0,0,"Baked goods; Canned, preserved fruits/vegetables; Dairy products; Dry beans; Eggs; Fresh/dried herbs; Fresh fruits; Fresh vegetables; Grains/flour; Honey; Juices/non-alcoholic ciders; Maple products; Nuts; Poultry/fowl meat/products; Red/non-poultry meat/products; Soap/body care products; ",,Coffee/tea; ,,1,1,3,,1,1,1,,1,1,1,1,,1,1,1,,1,,1,1,1,,,,,0,0,0,0,0,0,0,0,0,0,0,0,0,0,,0,0,0,0,0,0,0,0,0,0,0,0,0,0,On-line store; Your own storefront retail; Farmers markets; Mobile retail units/food trucks; ,0,1,1,0,1,1,0,We sell on a consignment basis and take a commission on products sold; ,0,1,Aggregation; Distribution services; Shared use kitchen; Packaging/Repackaging; Product storage; Canning; ,1,0,1,0,1,1,1,1,0,0,Marketing and promotional services; Business management services or guidance; Transportation services; ,1,0,0,0,1,0,0,0,1,Accepting SNAP; WIC or FMNP benefits; Matching programs for SNAP benefits; Nutrition or cooking education; ,0,1,1,1,1,0,0,0,0,0,0,0,0
5000158,Lane Local Foods,,2014-08-14 16:47:22,2014-08-14 16:47:22,Oregon,41,Eugene,41672,97404,Leisha Wood,Operations Manager,Eugenelocalfoods@lanefood.org,541-246-1611,http://www.localfoodmarketplace.com/eugene,https://www.facebook.com/eugenelocalfoods?fref=ts,,Oregon,41,Lane,039,418 A Street,Springfield,97477,,2008,8,LLC,Year Round;,1,1,1,1,1,1,1,1,1,1,1,1,1,,"Baked goods; Canned, preserved fruits/vegetables; Cut flowers; Dairy products; Dry beans; Eggs; Fresh/dried herbs; Fresh fruits; Fresh vegetables; Grains/flour; Honey; Mushrooms; Nuts; Pet food; Poultry/fowl meat/products; Red/non-poultry meat/products; Wild harvested forest products; Food Hub branded merchandise; ",1,1,0,1,1,1,1,0,1,1,1,1,0,1,0,0,1,1,1,1,1,0,0,1,0,"Baked goods; Canned, preserved fruits/vegetables; Cut flowers; Dairy products; Dry beans; Eggs; Fresh/dried herbs; Fresh fruits; Fresh vegetables; Grains/flour; Honey; Mushrooms; Nuts; Pet food; Poultry/fowl meat/products; Red/non-poultry meat/products; Wild harvested forest products; ",,,,1,1,,1,1,1,1,,1,1,1,1,,1,,,1,1,1,1,1,,,1,,,0,0,0,0,0,0,0,0,0,0,0,0,0,0,"Restaurants; Caterers, bakeries; Food processors; ",0,0,0,0,1,1,0,1,0,0,0,0,0,0,On-line store; ,0,1,0,0,0,0,0,We sell on a consignment basis and take a commission on products sold; ,0,1,Aggregation; Distribution services; Product storage; ,1,0,1,0,0,0,1,0,0,0,Marketing and promotional services; ,1,0,0,0,0,0,0,0,0,Accepting SNAP; ,0,1,0,0,0,0,0,0,0,0,0,0,0
5000296,LINC Foods,2014-09-08 22:36:21,2014-09-08 22:44:19,2014-09-08 22:44:19,Washington,53,Spokane,1820 E. 9th Ave,99202,Joel Williamson,President and Member-Owner,Joel@camaspartners.com,509-230-1223,www.LINCFoods.com,,,Washington,53,Spokane,063,1234 E. Front Ave,Spokane,99202,Co-located with the 2nd Harvest Food Bank. ,2014,12,Worker-Owned Cooperative,Year Round;,1,1,1,1,1,1,1,1,1,1,1,1,1,,Dairy products; Dry beans; Eggs; Fresh fruits; Fresh vegetables; Grains/flour; Honey; Poultry/fowl meat/products; Red/non-poultry meat/products; ,0,0,0,0,1,1,1,0,0,1,1,1,0,1,0,0,0,0,0,1,1,0,0,0,0,Dairy products; Dry beans; Eggs; Fresh fruits; Fresh vegetables; Grains/flour; Honey; Poultry/fowl meat/products; Red/non-poultry meat/products; ,,,,,,,,1,1,1,,,1,1,1,,1,,,,,,1,1,,,,,"Non-Certified, but Practicing Organic; Free Range/Pasture Raised; Grass Fed; Antibiotic Free; Chemical Free; ",0,0,0,1,1,1,1,0,1,0,0,0,0,0,"Small independent grocery stores; Restaurants; Caterers, bakeries; Distributors; K-12 school food service; Colleges/Universities; Senior care facilities; ",0,1,0,0,1,1,1,0,0,1,1,0,1,0,,0,0,0,0,0,0,0,We take ownership of the products and resell to customers; ,1,0,Aggregation; Distribution services; Brokering services; Packaging/Repackaging; Product storage; Cutting; ,1,0,1,1,0,1,1,0,0,1,Marketing and promotional services; Branding/labeling products to indicate origin of product; Business management services or guidance; Food safety and/or GAP Training; Liability insurance that you offer producers; ,1,1,0,0,1,0,1,1,0,Other education or community awareness programs; Food donation to local food pantries/banks; ,0,0,0,0,0,0,0,0,0,0,0,1,1
5000004,Little Rock Local Food Club,,2014-07-25 11:35:21,2014-07-25 11:35:21,Arkansas,05,Little Rock,509 Scott St,72201,Rebecca Wild,Program Manager,littlerockfoodclub@gmail.com,(501)396-9952,http://littlerock.locallygrown.net,https://www.facebook.com/ARSustainability,,Arkansas,05,Pulaski,119,509 Scott St,Little Rock,72201,,2011,1,Non-Profit,Year Round;,1,1,1,1,1,1,1,1,1,1,1,1,1,,"Baked goods; Canned, preserved fruits/vegetables; Coffee/tea; Cut flowers; Dairy products; Eggs; Fresh/dried herbs; Fresh fruits; Fresh vegetables; Green household products; Honey; Juices/non-alcoholic ciders; Mushrooms; Nuts; Poultry/fowl meat/products; Red/non-poultry meat/products; Soap/body care products; ",1,1,1,1,1,0,1,0,1,1,1,0,1,1,1,0,1,1,0,1,1,1,0,0,0,"Baked goods; Canned, preserved fruits/vegetables; Cut flowers; Dairy products; Eggs; Fresh fruits; Fresh vegetables; Green household products; Honey; Juices/non-alcoholic ciders; Mushrooms; Nuts; Poultry/fowl meat/products; Red/non-poultry meat/products; Soap/body care products; ",,Coffee/tea; Fresh/dried herbs; ,,1,1,3,1,1,,1,,3,1,1,,1,1,1,,1,1,,1,1,1,,,,,0,0,0,0,0,0,0,0,0,0,0,0,0,0,,0,0,0,0,0,0,0,0,0,0,0,0,0,0,Buying clubs; On-line store; ,1,1,0,0,0,0,0,We take ownership of the products and resell to customers; We sell on a consignment basis and take a commission on products sold; ,1,1,,0,0,0,0,0,0,0,0,0,0,Marketing and promotional services; ,1,0,0,0,0,0,0,0,0,Nutrition or cooking education; Food donation to local food pantries/banks; ,0,0,0,0,1,0,0,0,0,0,0,0,1
5000193,Local Food Hub,,8/6/2014 9:45:05 AM,,Virginia,51,Charlottesville,PO Box 4647,22905,,,info@localfoodhub.org,,http://www.localfoodhub.org/,https://www.facebook.com/localfoodhub,,Virginia,51,Charlottesville,540,PO Box 4647,Charlottesville,22905,,2009,1,Non-Profit,Year Round;,1,1,1,1,1,1,1,1,1,1,1,1,1,,Cut flowers; Dairy products; Eggs; Fresh fruits; Fresh vegetables; Grains/flour; Honey; Juices/non-alcoholic ciders; Maple products; Mushrooms; Poultry/fowl meat/products; Red/non-poultry meat/products; ,0,0,0,1,1,0,1,0,0,1,1,1,0,1,1,1,1,0,0,1,1,0,0,0,0,Cut flowers; Dairy products; Eggs; Fresh fruits; Fresh vegetables; Grains/flour; Honey; Juices/non-alcoholic ciders; Maple products; Mushrooms; Poultry/fowl meat/products; Red/non-poultry meat/products; ,,,,,,,1,1,,1,,,1,1,1,,1,1,1,1,,,1,1,,,,,,0,0,0,0,0,0,0,0,0,0,0,0,0,0,Distributors; ,0,0,0,0,0,0,1,0,0,0,0,0,0,0,,0,0,0,0,0,0,0,We take ownership of the products and resell to customers; ,1,0,Aggregation; Distribution services; ,1,0,1,0,0,0,0,0,0,0,Marketing and promotional services; Branding/labeling products to indicate origin of product; Production and post-harvest handling training; Business management services or guidance; Food safety and/or GAP Training; ,1,1,0,1,1,0,1,0,0,Education programs for institutions; Other education or community awareness programs; Food donation to local food pantries/banks; ,0,0,0,0,0,0,0,0,0,0,1,1,1
5000266,Local Foods,2014-08-21 07:59:57,2014-08-21 08:12:42,2014-08-21 08:12:42,Illinois,17,Chicago,1427 W. Willow Ave.,60642,Andrew Lutsey,CEO,andrew@localfoods.com,7203178438,www.localfoods.com,https://www.facebook.com/localfoodsgrocer,https://twitter.com/LocalFoodsChi,Illinois,17,Cook,031,1427 W. Willow Ave,Chicago,60642,On Willow just east of Elston.,2012,8,LLC,Year Round;,1,1,1,1,1,1,1,1,1,1,1,1,1,,"Canned, preserved fruits/vegetables; Dairy products; Dry beans; Eggs; Fresh/dried herbs; Fresh fruits; Fresh vegetables; Grains/flour; Honey; Maple products; Mushrooms; Nuts; Poultry/fowl meat/products; Red/non-poultry meat/products; Wild harvested forest products; ",0,1,0,0,1,1,1,0,1,1,1,1,0,1,0,1,1,1,0,1,1,0,0,1,0,"Canned, preserved fruits/vegetables; Dairy products; Dry beans; Eggs; Fresh/dried herbs; Fresh fruits; Fresh vegetables; Grains/flour; Honey; Maple products; Mushrooms; Nuts; Poultry/fowl meat/products; Red/non-poultry meat/products; Wild harvested forest products; ",,,,,1,,,1,1,1,,1,1,1,1,,1,,1,1,1,,1,1,,,1,,,0,0,0,0,0,0,0,0,0,0,0,0,0,0,"Large supermarkets or supercenters; Small independent grocery stores; Restaurants; Caterers, bakeries; Distributors; Food processors; K-12 school food service; Colleges/Universities; ",1,1,0,0,1,1,1,1,0,1,1,0,0,0,Your own storefront retail; ,0,0,1,0,0,0,0,We take ownership of the products and resell to customers; ,1,0,Aggregation; Distribution services; Packaging/Repackaging; Product storage; ,1,0,1,0,0,1,1,0,0,0,Marketing and promotional services; Branding/labeling products to indicate origin of product; Transportation services; Crop planning; ,1,1,0,0,0,0,0,0,1,Accepting SNAP; WIC or FMNP benefits; Nutrition or cooking education; Meal preparation; Education programs for institutions; Other education or community awareness programs; Food donation to local food pantries/banks; ,0,1,1,0,1,1,0,0,0,0,1,1,1
5000148,Local Roots Market & Caf (Wooster Local Foods Cooperative),,2014-09-17 00:10:12,2014-09-17 00:10:12,Ohio,39,Wooster,140 S. Walnut Street,44691,Melissa Williams,Manager,roots@localrootswooster.com,330-263-5336,http://www.localrootswooster.com,https://www.facebook.com/pages/Local-Roots-Market-Caf%C3%A9/142459175781117,,Ohio,39,Wayne,169,140 S. Walnut Street,Wooster,44691,,2009,4,Producer-Consumer Cooperative,Year Round;,1,1,1,1,1,1,1,1,1,1,1,1,1,,"Baked goods; Canned, preserved fruits/vegetables; Coffee/tea; Cut flowers; Dairy products; Eggs; Fish/seafood; Fresh/dried herbs; Fresh fruits; Fresh vegetables; Grains/flour; Honey; Juices/non-alcoholic ciders; Maple products; Mushrooms; Poultry/fowl meat/products; Red/non-poultry meat/products; Soap/body care products; Tofu/non-animal protein; Wild harvested forest products; ready to eat foods; ",1,1,1,1,1,0,1,1,1,1,1,1,0,1,1,1,1,0,0,1,1,1,1,1,0,"Baked goods; Canned, preserved fruits/vegetables; Coffee/tea; Cut flowers; Dairy products; Eggs; Fish/seafood; Fresh/dried herbs; Fresh fruits; Fresh vegetables; Grains/flour; Honey; Juices/non-alcoholic ciders; Maple products; Mushrooms; Poultry/fowl meat/products; Red/non-poultry meat/products; Soap/body care products; Tofu/non-animal protein; Wild harvested forest products; ",,,,1,1,1,1,1,,1,1,1,1,1,1,,1,1,1,1,,,1,1,1,1,1,,,0,0,0,0,0,0,0,0,0,0,0,0,0,0,,0,0,0,0,0,0,0,0,0,0,0,0,0,0,Your own storefront retail; ,0,0,1,0,0,0,0,We take ownership of the products and resell to customers; We sell on a consignment basis and take a commission on products sold; ,1,1,Aggregation; Distribution services; Shared use kitchen; Packaging/Repackaging; Product storage; Freezing; Cutting; ,1,0,1,0,1,1,1,0,1,1,Marketing and promotional services; ,1,0,0,0,0,0,0,0,0,Accepting SNAP; Nutrition or cooking education; Education programs for institutions; Other education or community awareness programs; Food donation to local food pantries/banks; ,0,1,0,0,1,0,0,0,0,0,1,1,1
5000026,LoCo Food Distribution,,2014-07-25 10:13:16,2014-07-25 10:13:16,Colorado,08,Fort Collins,229 N US HWY 287,80524,Elizabeth Mozer,CEO/COO,info@LoCoFoodDistribution.com,9704933663,http://www.locofooddistribution.com,https://www.facebook.com/LoCoFoodDistribution,,Colorado,08,Larimer,069,229 N US HWY 287,Fort Collins,80524,,2011,8,LLC,Year Round;,1,1,1,1,1,1,1,1,1,1,1,1,1,,"Baked goods; Canned, preserved fruits/vegetables; Coffee/tea; Dairy products; Dry beans; Eggs; Fresh/dried herbs; Fresh fruits; Fresh vegetables; Grains/flour; Honey; Juices/non-alcoholic ciders; Mushrooms; Nuts; Poultry/fowl meat/products; Red/non-poultry meat/products; Soap/body care products; ",1,1,1,0,1,1,1,0,1,1,1,1,0,1,1,0,1,1,0,1,1,1,0,0,0,"Baked goods; Canned, preserved fruits/vegetables; Coffee/tea; Dairy products; Dry beans; Eggs; Fresh/dried herbs; Fresh fruits; Fresh vegetables; Grains/flour; Honey; Juices/non-alcoholic ciders; Mushrooms; Nuts; Poultry/fowl meat/products; Red/non-poultry meat/products; Soap/body care products; ",,,,1,1,1,,1,1,1,,1,1,1,1,,1,1,,1,1,,1,1,1,,,,,0,0,0,0,0,0,0,0,0,0,0,0,0,0,"Large supermarkets or supercenters; Small independent grocery stores; Corner stores, bodegas; Food retail cooperatives; Restaurants; Colleges/Universities; Hospitals; Government or corporate cafeterias; ",1,1,1,1,1,0,0,0,0,0,1,1,0,1,,0,0,0,0,0,0,0,We take ownership of the products and resell to customers; ,1,0,Distribution services; Product storage; ,0,0,1,0,0,0,1,0,0,0,Marketing and promotional services; Branding/labeling products to indicate origin of product; Business management services or guidance; Food safety and/or GAP Training; ,1,1,0,0,1,0,1,0,0,Food donation to local food pantries/banks; ,0,0,0,0,0,0,0,0,0,0,0,0,1
5000321,Lucky Dog Local Food Hub,2014-11-02 08:30:54,2014-11-02 08:42:11,2014-11-02 08:42:11,New York,36,Hamden,35796 State Highway 10,13782,Sonia Janiszewski,,hub@luckydogorganic.com,914-720-1020,http://www.luckydogorganic.com/,https://www.facebook.com/Lucky.Dog.Farm.And.Store,,New York,36,Delaware,025,,Hamden,13782,Located on Main Street/State Highway 10 in the middle of Hamden.,2012,0,,Year Round;,1,1,1,1,1,1,1,1,1,1,1,1,1,,Dairy products; Eggs; Fresh/dried herbs; Fresh fruits; Fresh vegetables; Grains/flour; Maple products; Poultry/fowl meat/products; ,0,0,0,0,1,0,1,0,1,1,1,1,0,0,0,1,0,0,0,1,0,0,0,0,0,Dairy products; Eggs; Fresh/dried herbs; Fresh fruits; Fresh vegetables; Grains/flour; Maple products; Poultry/fowl meat/products; ,,,,,,,,1,,1,,1,1,1,1,,,,1,,,,1,,,,,,,0,0,0,0,0,0,0,0,0,0,0,0,0,0,Small independent grocery stores; Food retail cooperatives; Restaurants; ,0,1,0,1,1,0,0,0,0,0,0,0,0,0,Buying clubs; Farmers markets; ,1,0,0,0,1,0,0,The Hub transports pre-sold products to buyers in NYC for a fee; ,0,0,Aggregation; Distribution services; Brokering services; Product storage; ,1,0,1,1,0,0,1,0,0,0,Marketing and promotional services; Production and post-harvest handling training; Business management services or guidance; Liability insurance that you offer producers; Transportation services; ,1,0,0,1,1,0,0,1,1,Paid employment opportunities for youth; Accepting SNAP; WIC or FMNP benefits; ,1,1,1,0,0,0,0,0,0,0,0,0,0
5000313,Maine Lobster Now,2014-10-13 14:24:47,2014-10-13 14:28:02,2014-10-13 14:28:02,Maine,23,South Portland,104 Thadeus St,04106,Maine Lobster Now,,info@mainelobsternow.com,2077998222,http://www.mainelobsternow.com,http://www.facebook.com/mainelobsternow,http://www.twitter.com/mainelobsternow,Maine,23,Cumberland,005,,South Portland,,,2012,5,S Corp,Year Round;,1,1,1,1,1,1,1,1,1,1,1,1,,,Poultry/fowl meat/products; Lobster; ,0,0,0,0,0,0,0,0,0,0,0,0,0,0,0,0,0,0,0,1,0,0,0,0,0,Poultry/fowl meat/products; ,,,,,,,,,,,,,,,,,,,,,,,1,,,,,,,0,0,0,0,0,0,0,0,0,0,0,0,0,0,,0,0,0,0,0,0,0,0,0,0,0,0,0,0,,0,0,0,0,0,0,0,,0,0,,0,0,0,0,0,0,0,0,0,0,,0,0,0,0,0,0,0,0,0,,0,0,0,0,0,0,0,0,0,0,0,0,0
5000018,Mandela MarketPlace,,2014-08-14 17:31:38,2014-08-14 17:31:38,California,06,Oakland,1364 7th Street,94607,Mariela Cedeo,"Director, Social Enterprise & Communications",mariela@mandelamarketplace.org,(510) 433-0993,http://www.mandelamarketplace.org/,https://www.facebook.com/pages/Mandela-Marketplace/131273713549358,https://twitter.com/MandelaMarket,California,06,Alameda,001,1364 Seventh Street,Oakland,94607,,2006,1,Non-Profit,Year Round;,1,1,1,1,1,1,1,1,1,1,1,1,1,,Fresh fruits; Fresh vegetables; Grains/flour; ,0,0,0,0,0,0,0,0,0,1,1,1,0,0,0,0,0,0,0,0,0,0,0,0,0,Grains/flour; ,Fresh fruits; Fresh vegetables; ,,,,,,,,,,,,2,2,1,,,,,,,,,,,,,,"USDA Certified Organic; Non-Certified, but Practicing Organic; ",1,0,0,1,0,0,0,0,0,0,0,0,0,0,"Large supermarkets or supercenters; Small independent grocery stores; Corner stores, bodegas; Food retail cooperatives; Restaurants; Caterers, bakeries; corporate wellness programs; ",1,1,1,1,1,1,0,0,0,0,0,0,0,0,community produce stands; ,0,0,0,0,0,0,0,We take ownership of the products and resell to customers; ,1,0,Aggregation; Distribution services; ,1,0,1,0,0,0,0,0,0,0,Marketing and promotional services; Branding/labeling products to indicate origin of product; Transportation services; ,1,1,0,0,0,0,0,0,1,Paid employment opportunities for youth; Accepting SNAP; Nutrition or cooking education; Operating a mobile market; Other education or community awareness programs; Food donation to local food pantries/banks; ,1,1,0,0,1,0,0,0,1,0,0,1,1
5000065,Massachusetts Local Food Cooperative,,2014-07-30 13:12:11,2014-07-30 13:12:11,Massachusetts,25,Westminster,PO Box 26,01473,Mae Zagami,President,Masslocalfood@gmail.com,9785670717,http://www.masslocalfood.org,,,Massachusetts,25,Middlesex,017,114 Coburn Avenue,Gardner,01440,,2009,6,C Corp,Year Round;,1,1,1,1,1,1,1,1,1,1,1,1,1,,"Baked goods; Canned, preserved fruits/vegetables; Coffee/tea; Cut flowers; Dairy products; Eggs; Fresh/dried herbs; Fresh fruits; Fresh vegetables; Grains/flour; Honey; Maple products; Pet food; Poultry/fowl meat/products; Red/non-poultry meat/products; Soap/body care products; Wild harvested forest products; ",1,1,1,1,1,0,1,0,1,1,1,1,0,1,0,1,0,0,1,1,1,1,0,1,0,"Baked goods; Canned, preserved fruits/vegetables; Coffee/tea; Cut flowers; Dairy products; Eggs; Fresh/dried herbs; Fresh fruits; Fresh vegetables; Grains/flour; Honey; Maple products; Pet food; Poultry/fowl meat/products; Red/non-poultry meat/products; Soap/body care products; Wild harvested forest products; ",,,,1,1,1,1,1,,1,,1,1,1,1,,1,,1,,,1,1,1,1,,1,,"USDA Certified Organic; Certified Naturally Grown; Integrated Pest Management; Non-Certified, but Practicing Organic; Free Range/Pasture Raised; Grass Fed; Antibiotic Free; Chemical Free; Good Agricultural Practices - (GAP)-Certified; Certified Humane; Animal Welfare Approved; ",1,1,1,1,1,1,1,0,1,1,0,1,1,0,,0,0,0,0,0,0,0,0,0,0,0,0,0,0,Co-op Members; ,0,0,0,0,0,0,0,We sell on a consignment basis and take a commission on products sold; ,0,1,Aggregation; Distribution services; ,1,0,1,0,0,0,0,0,0,0,Marketing and promotional services; ,1,0,0,0,0,0,0,0,0,Food donation to local food pantries/banks; ,0,0,0,0,0,0,0,0,0,0,0,0,1
5000271,Milton's Local,2014-08-24 12:26:31,2014-08-24 12:33:22,2014-08-24 12:33:22,Virginia,51,Hopewell,P.O. Box 1293,23860,M. James Faison,President,james@miltonslocal.com,8049252644,www.miltonslocal.com,https://www.facebook.com/miltonslocal,www.twitter.com/miltonslocal,Virginia,51,Richmond City,760,3811 Castlewood Rd.,Richmond,23234,,2012,8,LLC,Year Round;,1,1,1,1,1,1,1,1,1,1,1,1,2,,Poultry/fowl meat/products; Red/non-poultry meat/products; ,0,0,0,0,0,0,0,0,0,0,0,0,0,0,0,0,0,0,0,1,1,0,0,0,0,Poultry/fowl meat/products; Red/non-poultry meat/products; ,,,,,,,,,,,,,,,,,,,,,,,1,1,,,,,Antibiotic Free; ,0,0,0,0,0,0,1,0,0,0,0,0,0,0,Small independent grocery stores; Food retail cooperatives; Restaurants; Colleges/Universities; Hospitals; ,0,1,0,1,1,0,0,0,0,0,1,1,0,0,Buying clubs; CSA shares; ,1,0,0,1,0,0,0,We take ownership of the products and resell to customers; We sell on a consignment basis and take a commission on products sold; ,1,1,Aggregation; Distribution services; Brokering services; Product storage; ,1,0,1,1,0,0,1,0,0,0,Marketing and promotional services; Business management services or guidance; Liability insurance that you offer producers; Transportation services; ,1,0,0,0,1,0,0,1,1,Paid employment opportunities for youth; ,1,0,0,0,0,0,0,0,0,0,0,0,0
