5000152,Oklahoma Food Cooperative,,2014-08-26 15:54:27,2014-08-26 15:54:27,Oklahoma,40,Oklahoma City,1305 SW 2nd St,73108,Adam Price,Operations Manager,customer@oklahomafood.coop,405-605-8088,http://www.oklahomafood.coop/,https://www.facebook.com/oklahomafood,,Oklahoma,40,Oklahoma,109,1305 SW 2nd St.,Oklahoma City,73108,,2003,12,Cooperative,Year Round;,1,1,1,1,1,1,1,1,1,1,1,1,1,,"Baked goods; Canned, preserved fruits/vegetables; Coffee/tea; Cut flowers; Dairy products; Dry beans; Eggs; Fresh/dried herbs; Fresh fruits; Fresh vegetables; Grains/flour; Green household products; Honey; Mushrooms; Nuts; Pet food; Poultry/fowl meat/products; Red/non-poultry meat/products; Soap/body care products; ",1,1,1,1,1,1,1,0,1,1,1,1,1,1,0,0,1,1,1,1,1,1,0,0,0,"Baked goods; Canned, preserved fruits/vegetables; Coffee/tea; Cut flowers; Dairy products; Dry beans; Eggs; Fresh/dried herbs; Fresh fruits; Fresh vegetables; Grains/flour; Green household products; Honey; Mushrooms; Nuts; Pet food; Poultry/fowl meat/products; Red/non-poultry meat/products; Soap/body care products; ",,,,1,1,1,1,1,1,1,,1,1,1,1,1,1,,,1,1,1,1,1,1,,,,,0,0,0,0,0,0,0,0,0,0,0,0,0,0,,0,0,0,0,0,0,0,0,0,0,0,0,0,0,Buying clubs; On-line store; ,1,1,0,0,0,0,0,We sell on a consignment basis and take a commission on products sold; ,0,1,Distribution services; ,0,0,1,0,0,0,0,0,0,0,Marketing and promotional services; ,1,0,0,0,0,0,0,0,0,,0,0,0,0,0,0,0,0,0,0,0,0,0
5000325,One Source Foods,2014-11-05 10:49:27,2014-11-05 11:13:39,2014-11-05 11:13:39,Georgia,13,Conyers,P.O. Box 1508,30012,Kimberly Morris,Director,kmorris@mastermarketingcorp.com,770-922-9603,www.onesourcefoods.net,onesourcefoods,,Georgia,13,Rockdale,247,951 Peek Street,Conyers,30012,,2012,12,One Source Foods is owned by Master Marketing Corporation,Year Round;,1,1,1,1,1,1,1,1,1,1,1,1,2,,Baked goods; Coffee/tea; Fish/seafood; Honey; Poultry/fowl meat/products; Red/non-poultry meat/products; ,1,0,1,0,0,0,0,1,0,0,0,0,0,1,0,0,0,0,0,1,1,0,0,0,0,Honey; ,,Baked goods; Coffee/tea; Poultry/fowl meat/products; Red/non-poultry meat/products; ,,3,,3,,,,,,,,,,,1,,,,,,3,3,,,,,USDA approved; ,0,0,0,0,0,0,0,0,0,0,0,0,0,0,"Large supermarkets or supercenters; Small independent grocery stores; Corner stores, bodegas; Food retail cooperatives; Distributors; Food processors; Pre-K food service; Colleges/Universities; Senior care facilities; Food Banks; After School Feeding Centers; Non-profits; ",1,1,1,1,0,0,1,1,1,0,1,0,1,0,Buying clubs; On-line store; CSA shares; Mobile retail units/food trucks; ,1,1,0,1,0,1,0,We take ownership of the products and resell to customers; ,1,0,Aggregation; Distribution services; Packaging/Repackaging; Product storage; Freezing; ,1,0,1,0,0,1,1,0,1,0,Marketing and promotional services; Branding/labeling products to indicate origin of product; Transportation services; ,1,1,0,0,0,0,0,0,1,Accepting SNAP; Nutrition or cooking education; Operating a mobile market; Food donation to local food pantries/banks; Fundraising for community organizations; ,0,1,0,0,1,0,0,0,1,0,0,0,1
5000161,Organically Grown Company,,2014-07-30 17:45:05,2014-07-30 17:45:05,Oregon,41,Eugene,1800B Prairie Rd,97402,Tonya Haworth,Marketing Communications Specialist,info@organicgrown.com,503-907-3705,http://organicgrown.com,https://www.facebook.com/OrganicallyGrownCompany,https://twitter.com/organicgrownco,Oregon,41,Lane,039,1800B Prairie Rd,Eugene,97402,,1982,5,S Corp,Year Round;,1,1,1,1,1,1,1,1,1,1,1,1,1,,Fresh fruits; Fresh vegetables; ,0,0,0,0,0,0,0,0,0,1,1,0,0,0,0,0,0,0,0,0,0,0,0,0,0,,,Fresh fruits; Fresh vegetables; ,,,,,,,,,,,3,3,,,,,,,,,,,,,,,USDA Certified Organic; Good Agricultural Practices - (GAP)-Certified; GFS; ,1,0,0,0,0,0,0,0,0,1,0,0,0,0,"Large supermarkets or supercenters; Small independent grocery stores; Corner stores, bodegas; Food retail cooperatives; Restaurants; Caterers, bakeries; Distributors; Food processors; Pre-K food service; K-12 school food service; Colleges/Universities; Hospitals; Senior care facilities; Government or corporate cafeterias; ",1,1,1,1,1,1,1,1,1,1,1,1,1,1,,0,0,0,0,0,0,0,We take ownership of the products and resell to customers; We sell on a consignment basis and take a commission on products sold; ,1,1,Distribution services; Brokering services; ,0,0,1,1,0,0,0,0,0,0,Marketing and promotional services; Branding/labeling products to indicate origin of product; Food safety and/or GAP Training; Transportation services; ,1,1,0,0,0,0,1,0,1,Other education or community awareness programs; Food donation to local food pantries/banks; ,0,0,0,0,0,0,0,0,0,0,0,1,1
5000277,"Painted Hills Natural Beef, Inc.",2014-08-25 16:31:05,2014-08-25 17:19:38,2014-08-25 17:19:38,Oregon,41,Fossil,PO Box 245,97830,Jennifer Homer,Marketing Director,jen@natural-beef.com,541-763-2333,http://www.paintedhillsnaturalbeef.com/,https://www.facebook.com/pages/Painted-Hills-Natural-Beef/118504276553,https://twitter.com/PaintedHllsBeef,Oregon,41,Wheeler,069,600 Stone Cabin Court,Fossil,97830,Off John Day Hwy (19) between mile posts 57 & 58.,1997,12,Domestic Business Corporation,Year Round;,1,1,1,1,1,1,1,1,1,1,1,1,2,,Red/non-poultry meat/products; ,0,0,0,0,0,0,0,0,0,0,0,0,0,0,0,0,0,0,0,0,1,0,0,0,0,,,Red/non-poultry meat/products; ,,,,,,,,,,,,,,,,,,,,,,3,,,,,"Grass Fed; NO ADDED HORMONES, NO ANTIBIOTICS, PASTURE RAISED and fed a 100% VEGETARIAN DIET; Our cattle are never fed animal by-products of any kind.; ",0,0,0,0,0,1,0,0,0,0,0,0,0,0,Distributors; Food processors; ,0,0,0,0,0,0,1,1,0,0,0,0,0,0,On-line store; ,0,1,0,0,0,0,0,We take ownership of the products and resell to customers; ,1,0,Production such as operating a farm or ranch; ,0,1,0,0,0,0,0,0,0,0,Marketing and promotional services; Branding/labeling products to indicate origin of product; ,1,1,0,0,0,0,0,0,0,Paid employment opportunities for youth; ,1,0,0,0,0,0,0,0,0,0,0,0,0
5000275,"Peachtree Market, LLC",2014-08-25 13:38:48,2014-08-25 13:46:38,2014-08-25 13:46:38,North Carolina,37,Concord,363 Church Street North,28025,Jennifer Newton,,peachtreemarketconcord@gmail.com,704-788-1423,,https://www.facebook.com/PeachtreeMarket?ref=hl,,North Carolina,37,Cabarrus,025,363 Church Street North  Suite 190,Concord,28025,We are located in The Old Creamery building on Church Street...2 miles from Downtown Concord,2013,8,LLC,Year Round;,1,1,1,1,1,1,1,1,1,1,1,1,1,,"Baked goods; Canned, preserved fruits/vegetables; Dairy products; Eggs; Fish/seafood; Fresh fruits; Fresh vegetables; Grains/flour; Honey; Maple products; Nuts; Poultry/fowl meat/products; Red/non-poultry meat/products; ",1,1,0,0,1,0,1,1,0,1,1,1,0,1,0,1,0,1,0,1,1,0,0,0,0,"Baked goods; Canned, preserved fruits/vegetables; Dairy products; Eggs; Fish/seafood; Fresh fruits; Fresh vegetables; Grains/flour; Honey; Maple products; Nuts; Poultry/fowl meat/products; Red/non-poultry meat/products; ",,,,1,1,,,1,,1,1,,1,1,1,,1,,1,,1,,1,1,,,,,USDA Certified Organic; Certified Naturally Grown; Free Range/Pasture Raised; Grass Fed; ,1,1,0,0,1,1,0,0,0,0,0,0,0,0,,0,0,0,0,0,0,0,0,0,0,0,0,0,0,Your own storefront retail; ,0,0,1,0,0,0,0,We take ownership of the products and resell to customers; ,1,0,,0,0,0,0,0,0,0,0,0,0,Branding/labeling products to indicate origin of product; ,0,1,0,0,0,0,0,0,0,Accepting SNAP; ,0,1,0,0,0,0,0,0,0,0,0,0,0
5000265,Penn's Corner Farm Alliance,2014-08-20 14:07:19,2014-08-20 14:25:13,2014-08-20 14:25:13,Pennsylvania,42,Pittsburgh,6400 Hamilton Ave,15206,Neil Stauffer,,neil@pennscorner.com,4123631971,www.pennscorner.com,https://www.facebook.com/pages/Penns-Corner-Farm-Alliance/126564690707159,https://twitter.com/pennscorner,Pennsylvania,42,Allegheny,003,6400 Hamilton Ave,Pittsburgh,15206,On the corner of East Liberty Blvd and Hamilton Ave,1999,2,Producer Cooperative,Year Round;,1,1,1,1,1,1,1,1,1,1,1,1,1,,"Baked goods; Canned, preserved fruits/vegetables; Coffee/tea; Cut flowers; Dairy products; Dry beans; Eggs; Fresh/dried herbs; Fresh fruits; Fresh vegetables; Grains/flour; Green household products; Honey; Juices/non-alcoholic ciders; Maple products; Mushrooms; Poultry/fowl meat/products; Red/non-poultry meat/products; Soap/body care products; Tofu/non-animal protein; Wild harvested forest products; Pasta; ",1,1,1,1,1,1,1,0,1,1,1,1,1,1,1,1,1,0,0,1,1,1,1,1,0,"Baked goods; Canned, preserved fruits/vegetables; Cut flowers; Dairy products; Dry beans; Eggs; Fresh/dried herbs; Fresh fruits; Fresh vegetables; Grains/flour; Green household products; Honey; Juices/non-alcoholic ciders; Maple products; Mushrooms; Poultry/fowl meat/products; Soap/body care products; Wild harvested forest products; ",Red/non-poultry meat/products; Tofu/non-animal protein; ,,Coffee/tea; ,1,1,4,1,1,1,1,,1,1,1,1,1,1,1,1,1,,,1,2,1,2,1,,,0,0,0,0,0,0,0,0,0,0,0,0,0,0,"Small independent grocery stores; Corner stores, bodegas; Food retail cooperatives; Restaurants; Caterers, bakeries; Colleges/Universities; Senior care facilities; ",0,1,1,1,1,1,0,0,0,0,1,0,1,0,On-line store; CSA shares; ,0,1,0,1,0,0,0,We sell on a consignment basis and take a commission on products sold; ,0,1,Aggregation; Distribution services; Product storage; ,1,0,1,0,0,0,1,0,0,0,Marketing and promotional services; Branding/labeling products to indicate origin of product; Transportation services; ,1,1,0,0,0,0,0,0,1,Food donation to local food pantries/banks; ,0,0,0,0,0,0,0,0,0,0,0,0,1
5000273,Philadelphia Wholesale Produce Market,2014-08-25 12:31:20,2014-08-25 12:55:31,2014-08-25 12:51:26,Pennsylvania,42,Philadelphia,6700 Essington Avenue,19153,Christine Hofmann,,christineghofmann@gmail.com,856-220-7341,http://www.pwpm.net,https://www.facebook.com/pwpmproducemkt?ref=hl,https://twitter.com/pwpmproducemkt,Pennsylvania,42,Philadelphia,101,6700 Essington Avenue,Philadelphia,19153,Off I-95 See our website at www.pwpm.net,2011,5,S Corp,Year Round;,1,1,1,1,1,1,1,1,1,1,1,1,1,,Fresh/dried herbs; Fresh fruits; Fresh vegetables; Mushrooms; ,0,0,0,0,0,0,0,0,1,1,1,0,0,0,0,0,1,0,0,0,0,0,0,0,0,,,Fresh/dried herbs; Fresh fruits; Fresh vegetables; Mushrooms; ,,,,,,,,,,3,3,3,,,,,,3,,,,,,,,,,0,0,0,0,0,0,0,0,0,0,0,0,0,0,"Large supermarkets or supercenters; Small independent grocery stores; Corner stores, bodegas; Food retail cooperatives; Restaurants; Caterers, bakeries; Distributors; Food processors; Pre-K food service; K-12 school food service; Colleges/Universities; Hospitals; Senior care facilities; Government or corporate cafeterias; ",1,1,1,1,1,1,1,1,1,1,1,1,1,1,Buying clubs; On-line store; Your own storefront retail; CSA shares; Farmers markets; Mobile retail units/food trucks; Farm stands; ,1,1,1,1,1,1,1,We take ownership of the products and resell to customers; ,1,0,Brokering services; Packaging/Repackaging; Product storage; ,0,0,0,1,0,1,1,0,0,0,,0,0,0,0,0,0,0,0,0,Paid employment opportunities for youth; Food donation to local food pantries/banks; ,1,0,0,0,0,0,0,0,0,0,0,0,1
5000162,Philly CowShare,,2014-08-11 14:45:39,2014-08-11 14:45:39,Pennsylvania,42,Philadelphia,915 South 47th Street,19143,Jessica Moore,CEO,info@phillycowshare.com,267-872-7294,http://www.phillycowshare.com/,https://www.facebook.com/phillycowshare,https://twitter.com/phillycowshare,Pennsylvania,42,Philadelphia,101,915 South 47th Street,Philadelphia,19143,,2010,8,LLC,Year Round;,1,1,1,1,1,1,1,1,1,1,1,1,2,,,0,0,0,0,0,0,0,0,0,0,0,0,0,0,0,0,0,0,0,0,0,0,0,0,0,,,,,,,,,,,,,,,,,,,,,,,,,,,,,,Free Range/Pasture Raised; Grass Fed; Antibiotic Free; ,0,0,0,0,1,1,1,0,0,0,0,0,0,0,"Small independent grocery stores; Corner stores, bodegas; Food retail cooperatives; Restaurants; ",0,1,1,1,1,0,0,0,0,0,0,0,0,0,On-line store; ,0,1,0,0,0,0,0,"We buy the animals, make the products and sell the products.; ",0,0,Distribution services; Product storage; ,0,0,1,0,0,0,1,0,0,0,Marketing and promotional services; Branding/labeling products to indicate origin of product; Transportation services; ,1,1,0,0,0,0,0,0,1,,0,0,0,0,0,0,0,0,0,0,0,0,0
5000110,Pilot Mountain Pride,,2014-07-25 11:22:50,2014-07-25 11:22:50,North Carolina,37,Pilot Mountain,612 East Main Street,27041,Joshua Cave,Manager,sales@pilotmountainpride.com,336-444-8000,http://pilotmountainpride.blogspot.com/,https://www.facebook.com/pages/Pilot-Mountain-Pride/171380786285701?fref=ts,,North Carolina,37,Surry,171,612 East Main Street,Pilot Mountain,27041,,2010,8,LLC,Year Round;,1,1,1,1,1,1,1,1,1,1,1,1,2,,Fresh/dried herbs; Fresh fruits; Fresh vegetables; Mushrooms; ,0,0,0,0,0,0,0,0,1,1,1,0,0,0,0,0,1,0,0,0,0,0,0,0,0,Fresh/dried herbs; Fresh fruits; Fresh vegetables; Mushrooms; ,,,,,,,,,,,,1,1,1,,,,,,1,,,,,,,,,Good Agricultural Practices - (GAP)-Certified; ,0,0,0,0,0,0,0,0,0,1,0,0,0,0,Large supermarkets or supercenters; Small independent grocery stores; Restaurants; Distributors; K-12 school food service; Colleges/Universities; Hospitals; ,1,1,0,0,1,0,1,0,0,1,1,1,0,0,Public Market; E-CSA; ,0,0,0,0,0,0,0,We take ownership of the products and resell to customers; ,1,0,Aggregation; Distribution services; Brokering services; Packaging/Repackaging; Product storage; ,1,0,1,1,0,1,1,0,0,0,Marketing and promotional services; Production and post-harvest handling training; Business management services or guidance; Food safety and/or GAP Training; Transportation services; ,1,0,0,1,1,0,1,0,1,Other education or community awareness programs; Food donation to local food pantries/banks; ,0,0,0,0,0,0,0,0,0,0,0,1,1
5000329,POP Market,2014-11-18 16:33:56,2014-11-18 16:48:57,2014-11-18 16:48:57,North Carolina,37,Chapel Hill,2873,27515,Karla Capacetti,POP Market Manager,karla@farmerfoodshare.org,9102730669,http://www.farmerfoodshare.org/programs/pop-food-market/,https://www.facebook.com/farmerfoodshare,,North Carolina,37,Durham,063,"105 Hood St, Suite 5",Durham,27704,Near the intersection of Main Street and Fayetteville Road,2012,1,Non-Profit,Year Round;,1,1,1,1,1,1,1,1,1,1,1,1,1,,"Baked goods; Canned, preserved fruits/vegetables; Eggs; Fresh fruits; Fresh vegetables; ",1,1,0,0,0,0,1,0,0,1,1,0,0,0,0,0,0,0,0,0,0,0,0,0,0,"Baked goods; Canned, preserved fruits/vegetables; Eggs; Fresh fruits; Fresh vegetables; ",,,,1,1,,,,,1,,,1,1,,,,,,,,,,,,,,,,0,0,0,0,0,0,0,0,0,0,0,0,0,0,"Caterers, bakeries; Senior care facilities; Child care centers; Food pantries; ",0,0,0,0,0,1,0,0,0,0,0,0,1,0,,0,0,0,0,0,0,0,We sell on a consignment basis and take a commission on products sold; ,0,1,Aggregation; Distribution services; ,1,0,1,0,0,0,0,0,0,0,Marketing and promotional services; ,1,0,0,0,0,0,0,0,0,Nutrition or cooking education; Other education or community awareness programs; Food donation to local food pantries/banks; ,0,0,0,0,1,0,0,0,0,0,0,1,1
5000328,Produce Source Partners,2014-11-18 16:21:38,2014-11-18 16:32:43,2014-11-18 16:32:43,Virginia,51,Ashland,13167 Telcourt Road,23005,Produce Source Partners,"Director, Marketing - Sustainability Coordinator",Broach@WebPSP.com,804-798-5411,producesourcepartners.com,facebook.com/ProduceSourcePartners,twitter.com/PSPFresh,Virginia,51,Hanover,085,13167 Telcourt Road,Ashland,23005,,2009,5,S Corp,Year Round;,1,1,1,1,1,1,1,1,1,1,1,1,1,,Dairy products; Eggs; Fresh/dried herbs; Fresh fruits; Fresh vegetables; Honey; Juices/non-alcoholic ciders; Mushrooms; Nuts; Tofu/non-animal protein; ,0,0,0,0,1,0,1,0,1,1,1,0,0,1,1,0,1,1,0,0,0,0,1,0,0,,,Dairy products; Eggs; Fresh/dried herbs; Fresh fruits; Fresh vegetables; Honey; Juices/non-alcoholic ciders; Mushrooms; Nuts; Tofu/non-animal protein; ,,,,,,3,,3,,3,3,3,,,3,3,,3,3,,,,,3,,,Good Agricultural Practices - (GAP)-Certified; ,0,0,0,0,0,0,0,0,0,1,0,0,0,0,"Large supermarkets or supercenters; Small independent grocery stores; Corner stores, bodegas; Food retail cooperatives; Restaurants; Caterers, bakeries; Distributors; Food processors; Pre-K food service; K-12 school food service; Colleges/Universities; Hospitals; Senior care facilities; Government or corporate cafeterias; ",1,1,1,1,1,1,1,1,1,1,1,1,1,1,,0,0,0,0,0,0,0,We take ownership of the products and resell to customers; ,1,0,Aggregation; Distribution services; ,1,0,1,0,0,0,0,0,0,0,Marketing and promotional services; Food safety and/or GAP Training; Transportation services; ,1,0,0,0,0,0,1,0,1,Other education or community awareness programs; Food donation to local food pantries/banks; ,0,0,0,0,0,0,0,0,0,0,0,1,1
5000281,Puget Sound Food Hub,2014-08-26 12:47:20,2014-09-10 13:08:50,2014-09-10 13:08:50,Washington,53,Mount Vernon,P.O. Box 2924,98273,Lucy Norris,Director,info@pugetsoundfoodhub.com,360-336-3727,www.pugetsoundfoodhub.com,https://www.facebook.com/PugetSoundFoodHub,https://twitter.com/PugetSoundHub,Washington,53,Skagit,057,,"Bow (Skagit), Woodinville (King), Everson (Whatcom)",,"Aggregation and distribution is coordinated among three partner facilities: Woodinville (21 Acres), Everson (Cloud Mountain Farm Center) and Bow (Bow Hill Blueberries). Delivery is limited to Bellingham, Mt Vernon and Greater Seattle along the I-5 corridor. Administration offices are located at Northwest Agriculture Business Center in Mt Vernon (Skagit)",2009,1,Non-Profit,Year Round;,1,1,1,1,1,1,1,1,1,1,1,1,1,,"Baked goods; Canned, preserved fruits/vegetables; Cut flowers; Dairy products; Dry beans; Eggs; Fresh/dried herbs; Fresh fruits; Fresh vegetables; Grains/flour; Juices/non-alcoholic ciders; Poultry/fowl meat/products; Red/non-poultry meat/products; ",1,1,0,1,1,1,1,0,1,1,1,1,0,0,1,0,0,0,0,1,1,0,0,0,0,"Canned, preserved fruits/vegetables; Cut flowers; Dairy products; Dry beans; Eggs; Fresh/dried herbs; Fresh fruits; Fresh vegetables; Grains/flour; Juices/non-alcoholic ciders; Poultry/fowl meat/products; Red/non-poultry meat/products; ",,Baked goods; ,,3,1,,1,1,1,1,,1,1,1,1,,,1,,,,,1,1,,,,,,0,0,0,0,0,0,0,0,0,0,0,0,0,0,"Large supermarkets or supercenters; Small independent grocery stores; Food retail cooperatives; Restaurants; Caterers, bakeries; Food processors; Pre-K food service; Colleges/Universities; Hospitals; Senior care facilities; Government or corporate cafeterias; ",1,1,0,1,1,1,0,1,1,0,1,1,1,1,,0,0,0,0,0,0,0,We sell on a consignment basis and take a commission on products sold; ,0,1,Aggregation; Distribution services; Packaging/Repackaging; Product storage; Cutting; ,1,0,1,0,0,1,1,0,0,1,Marketing and promotional services; Branding/labeling products to indicate origin of product; Production and post-harvest handling training; Business management services or guidance; Paid consulting; Food safety and/or GAP Training; Cooperative development training and education; ,1,1,0,1,1,1,1,0,0,"Education programs for institutions; Other education or community awareness programs; Reduced order minimums for low-income childcare/preschool sites; Account credits up to $200 each for low-income childcare/preschool sites; Education programs and ""meet the farmer events"" targeting commercial customers; ",0,0,0,0,0,0,0,0,0,0,1,1,0
5000073,Red Tomato,,2014-07-29 10:33:41,2014-07-29 10:33:41,Massachusetts,25,Plainville,76 Everett Skinner Rd.,02762,Michael Rozyne,Executive Director and Chief Evangelist,info@redtomato.org,5083163494,http://www.redtomato.org,https://www.facebook.com/RedTomatoProduce,https://twitter.com/RedTomato_RT,Massachusetts,25,Norfolk,021,76 Everett Skinner Rd.,Plainville,02762,Old schoolhouse owned by the Order of Dominican Sisters at the intersection of Everett Skinner Rd. and School St.,1996,1,Non-Profit,Year Round;,1,1,1,1,1,1,1,1,1,1,1,1,1,,Fresh/dried herbs; Fresh fruits; Fresh vegetables; ,0,0,0,0,0,0,0,0,1,1,1,0,0,0,0,0,0,0,0,0,0,0,0,0,0,Fresh/dried herbs; Fresh fruits; Fresh vegetables; ,,,,,,,,,,,,1,1,1,,,,,,,,,,,,,,,,0,0,0,0,0,0,0,0,0,0,0,0,0,0,Large supermarkets or supercenters; Small independent grocery stores; Food retail cooperatives; Distributors; Colleges/Universities; Government or corporate cafeterias; ,1,1,0,1,0,0,1,0,0,0,1,0,0,1,,0,0,0,0,0,0,0,We take ownership of the products and resell to customers; ,1,0,Aggregation; Distribution services; Brokering services; ,1,0,1,1,0,0,0,0,0,0,Marketing and promotional services; Branding/labeling products to indicate origin of product; Production and post-harvest handling training; Paid consulting; Transportation services; ,1,1,0,1,0,1,0,0,1,Food donation to local food pantries/banks; ,0,0,0,0,0,0,0,0,0,0,0,0,1
5000330,Royal Food Service,2014-11-19 10:59:18,2014-11-19 11:20:56,2014-11-19 11:20:56,Georgia,13,Atlanta,PO Box 162389,30321,John Alpers,Vice President of Sales,jalpers@royalfoodservice.com,678-686-2216,www.royalfoodservice.com,https://www.facebook.com/RoyalFoodService,https://twitter.com/RoyalFoodSvc,Georgia,13,Clayton,063,3720 Zip Industrial Blvd SE,Atlanta,30354,,1994,5,S Corp,Year Round;,1,1,1,1,1,1,1,1,1,1,1,1,1,,Dairy products; Eggs; Fresh/dried herbs; Fresh fruits; Fresh vegetables; Honey; Juices/non-alcoholic ciders; Mushrooms; Nuts; ,0,0,0,0,1,0,1,0,1,1,1,0,0,1,1,0,1,1,0,0,0,0,0,0,0,Eggs; Honey; ,Fresh fruits; Fresh vegetables; ,Dairy products; Fresh/dried herbs; Juices/non-alcoholic ciders; Mushrooms; Nuts; ,,,,,,3,,1,,3,2,2,,,1,3,,3,3,,,,,,,,,0,0,0,0,0,0,0,0,0,0,0,0,0,0,"Large supermarkets or supercenters; Small independent grocery stores; Restaurants; Caterers, bakeries; Distributors; Food processors; Pre-K food service; K-12 school food service; Colleges/Universities; Hospitals; Senior care facilities; Government or corporate cafeterias; ",1,1,0,0,1,1,1,1,1,1,1,1,1,1,Mobile retail units/food trucks; ,0,0,0,0,0,1,0,We take ownership of the products and resell to customers; ,1,0,Aggregation; Distribution services; Packaging/Repackaging; Cutting; ,1,0,1,0,0,1,0,0,0,1,Marketing and promotional services; Branding/labeling products to indicate origin of product; Food safety and/or GAP Training; Transportation services; ,1,1,0,0,0,0,1,0,1,Education programs for institutions; Food donation to local food pantries/banks; ,0,0,0,0,0,0,0,0,0,0,1,0,1
5000218,Rutland Area Farm and Food Link - Farm Fresh Connects,,2014-07-23 17:14:52,2014-07-23 17:14:52,Vermont,50,Rutland,P.O. Box 284,05702,Tara Kelly,,info@rutlandfarmandfood.org,802-417-7331,http://www.rutlandfarmandfood.org/grn_mtn_food_hub.html,https://www.facebook.com/rutlandfarmfood?fref=ts,,Vermont,50,Rutland,021,67 Merchants Row,Rutland,05701,,2009,1,Non-Profit,Year Round;,1,1,1,1,1,1,1,1,1,1,1,1,2,,"Baked goods; Canned, preserved fruits/vegetables; Dry beans; Eggs; Fresh/dried herbs; Fresh fruits; Fresh vegetables; Grains/flour; Honey; Maple products; Poultry/fowl meat/products; Red/non-poultry meat/products; Soap/body care products; Wild harvested forest products; ",1,1,0,0,0,1,1,0,1,1,1,1,0,1,0,1,0,0,0,1,1,1,0,1,0,"Baked goods; Canned, preserved fruits/vegetables; Dry beans; Eggs; Fresh/dried herbs; Fresh fruits; Fresh vegetables; Grains/flour; Honey; Maple products; Poultry/fowl meat/products; Red/non-poultry meat/products; Soap/body care products; Wild harvested forest products; ",,,,1,1,,,,1,1,,1,1,1,1,,1,,1,,,,1,1,1,,1,,,0,0,0,0,0,0,0,0,0,0,0,0,0,0,K-12 school food service; ,0,0,0,0,0,0,0,0,0,1,0,0,0,0,Buying clubs; On-line store; CSA shares; ,1,1,0,1,0,0,0,We sell on a consignment basis and take a commission on products sold; ,0,1,Aggregation; Distribution services; Packaging/Repackaging; ,1,0,1,0,0,1,0,0,0,0,Marketing and promotional services; Production and post-harvest handling training; Business management services or guidance; Food safety and/or GAP Training; ,1,0,0,1,1,0,1,0,0,Nutrition or cooking education; Education programs for institutions; Other education or community awareness programs; Food donation to local food pantries/banks; ,0,0,0,0,1,0,0,0,0,0,1,1,1
5000295,Seattle Tilth Produce,2014-09-08 15:48:38,2014-09-08 16:00:00,2014-09-08 16:00:00,Washington,53,Seattle,4649 Sunnyside Ave N Ste 100,98103,Chris Iberle,,chrisiberle@seattletilth.org,206-633-0451 x129,http://seattletilth.org/about/stproduce,https://www.facebook.com/SeattleTilth,https://twitter.com/seattletilth,Washington,53,King,033,,Seattle,,,2013,1,Non-Profit,Apr; May; Jun; Jul; Aug; Sep; Oct; Nov;,0,0,0,1,1,1,1,1,1,1,1,0,1,,Coffee/tea; Dairy products; Dry beans; Eggs; Fresh/dried herbs; Fresh fruits; Fresh vegetables; Grains/flour; Honey; Mushrooms; Poultry/fowl meat/products; Red/non-poultry meat/products; Wild harvested forest products; ,0,0,1,0,1,1,1,0,1,1,1,1,0,1,0,0,1,0,0,1,1,0,0,1,0,Dairy products; Dry beans; Eggs; Fresh/dried herbs; Fresh fruits; Fresh vegetables; Grains/flour; Honey; Mushrooms; Poultry/fowl meat/products; Red/non-poultry meat/products; Wild harvested forest products; ,,,Coffee/tea; ,,,4,,1,1,1,,1,1,1,1,,1,,,1,,,1,1,,,1,,"Certified Naturally Grown; Non-Certified, but Practicing Organic; ",0,1,0,1,0,0,0,0,0,0,0,0,0,0,"Small independent grocery stores; Food retail cooperatives; Restaurants; Caterers, bakeries; Food processors; ",0,1,0,1,1,1,0,1,0,0,0,0,0,0,CSA shares; Farmers markets; Farm stands; ,0,0,0,1,1,0,1,We sell on a consignment basis and take a commission on products sold; ,0,1,Aggregation; Production such as operating a farm or ranch; Distribution services; Brokering services; Product storage; ,1,1,1,1,0,0,1,0,0,0,Marketing and promotional services; Branding/labeling products to indicate origin of product; Demonstration/Incubator farm; Production and post-harvest handling training; Business management services or guidance; Food safety and/or GAP Training; Transportation services; ,1,1,1,1,1,0,1,0,1,Paid employment opportunities for youth; Accepting SNAP; WIC or FMNP benefits; Matching programs for SNAP benefits; Nutrition or cooking education; Subsidized farm shares; Education programs for institutions; Other education or community awareness programs; Food donation to local food pantries/banks; ,1,1,1,1,1,0,0,0,0,1,1,1,1
