OF_ID,createTime,updateTime,finishTime,Location_ST,Location_City,Location_State,Location_StateFIPS,Location_Zip,marketname,Market_Website,Market_Facebook,Market_Twitter,season1_date,season1_time,season1_notes,season1_products,season2_date,season2_time,season2_notes,season2_products,season3_date,season3_time,season3_notes,season3_products,season4_date,season4_time,season4_notes,season4_products,Product_1,Product_2,Product_3,Product_4,Product_5,Product_6,Product_7,Product_8,Product_9,Product_10,Product_11,Product_12,Product_13,Product_14,Product_15,Product_16,Product_17,Product_18,Product_19,Product_20,Product_21,Product_22,Product_23,Product_24,Product_25,Product_26,Product_27,Product_28,ActivityList,Activity_1,Activity_2,Activity_3,Activity_4,Activity_5,Activity_6,Activity_7,Activity_8,Activity_9,Activity_10,Activity_11,FacilitiesList,Facilities_1,Facilities_2,Facilities_3,Facilities_4,Facilities_5,Payment_2,Payment_3,Payment_4,Payment_1
4017157,2014-08-05 15:54:25,2014-08-05 16:03:36,2014-08-05 16:03:36,14475 Quincy Street,Holland,Michigan,26,49424,deBerry Shack,,www.facebook.com/deBerryShack,,07/19/2014 to 10/31/2014,Mon: 10:00 AM - 8:00 PM;Tue: 10:00 AM - 8:00 PM;Wed: 10:00 AM - 8:00 PM;Thu: 10:00 AM - 8:00 PM;Fri: 10:00 AM - 8:00 PM;Sat: 8:00 AM - 8:00 PM;Sun: 8:00 AM - 8:00 PM;,The stand remains open as the produce is available.  We will restock throughout the day.,Crafts and/or woodworking items; Cut flowers; Herbs; Fresh fruits; Fresh vegetables;,,,,,,,,,,,,,0,0,0,0,1,1,0,0,0,0,1,1,1,0,0,0,0,0,0,0,0,0,0,0,0,0,0,0,,0,0,0,0,0,0,0,0,0,0,0,,0,0,0,0,1,1,0,0,0
4014075,,2014-07-27 11:29:44,2014-07-27 11:29:44,15970 highway 271,Tyler,Texas,48,75708,Deep Creek Farm,,,,06/06/2014 to 07/16/2014,Mon: 7:30 AM - 6:00 PM;Tue: 7:30 AM - 6:00 PM;Wed: 7:30 AM - 6:00 PM;Thu: 7:30 AM - 6:00 PM;Fri: 7:30 AM - 6:00 PM;Sat: 7:30 AM - 6:00 PM;Sun: 12:00 PM - 5:00 PM;,,Canned or preserved food; Cut flowers; Fresh fruits; Honey;,,,,,,,,,,,,,0,0,1,0,0,1,0,0,0,0,0,1,0,0,1,0,0,0,0,0,0,0,0,0,0,0,0,0,Pick Your Own/U-Pick operation; ,0,0,0,0,1,0,0,0,0,0,0,Hand washing station(s); Flush toilets; ,1,1,0,0,0,1,1,1,0
4017462,2014-09-18 10:46:01,2014-09-18 10:52:01,2014-09-18 10:52:01,E8975 E. Ridge Road,Westby,Wisconsin,55,54667,Deep Rooted,http://www.deeprootedorganics.com/,https://www.facebook.com/DeepRootedWestby,,04/25/2015 to 10/31/2015,,,Bedding plants; Canned or preserved food; Herbs; Fresh vegetables;,,,,,,,,,,,,,0,1,1,0,0,0,0,0,0,0,1,0,1,0,0,0,0,0,0,0,0,0,0,0,0,0,0,0,Educational tours/ classes; ,0,1,0,0,0,0,0,0,0,0,0,,0,0,0,0,1,1,1,1,0
4017138,2014-07-28 19:54:25,2014-07-28 20:08:17,2014-07-28 20:08:17,118 Raven Ridge,Hiwassee ,Virginia,51,24347,Deer Haven Blueberry Patch,www.deerhavenblueberrypatch.com,https://www.facebook.com/pages/Deer-Haven-Blueberry-Patch/384646871675070,,06/15/2014 to 07/25/2014,Thu: 8:00 AM - 4:00 PM;Fri: 8:00 AM - 4:00 PM;Sat: 8:00 AM - 4:00 PM;Sun: 12:00 PM - 4:00 PM;,,Fresh fruits;,,,,,,,,,,,,,0,0,0,0,0,0,0,0,0,0,0,1,0,0,0,0,0,0,0,0,0,0,0,0,0,0,0,0,Pick Your Own/U-Pick operation; ,0,0,0,0,1,0,0,0,0,0,0,Hand washing station(s); ,1,0,0,0,0,1,0,0,0
4015695,,2014-08-26 12:26:14,2014-08-26 12:26:14,1565 Saint Johns Church Road NE,Lanesville,Indiana,18,47136,Deere Farms Corn Maze and Pumpkin Patch,www.deerefarms.com,https://www.facebook.com/DeereFarmsCornMaze,,09/20/2014 to 11/02/2014,Fri: 5:00 PM - 8:00 PM;Sat: 11:00 AM - 8:00 PM;Sun: 12:00 PM - 6:00 PM;,Weekday School tours are by appointment Monday through Friday 9:00am to 3:00pm,Baked goods; Bedding plants;,05/01/2015 to 06/05/2015,Mon: 9:00 AM - 3:00 PM;Tue: 9:00 AM - 3:00 PM;Wed: 9:00 AM - 3:00 PM;Thu: 9:00 AM - 3:00 PM;Fri: 9:00 AM - 3:00 PM;Sat: 9:00 AM - 6:00 PM;,Group and School Tours are by appointment Monday through Friday 9am to 3pm.,,06/08/2015 to 08/14/2015,,School and group events are by appointment only.,,,,,,1,1,0,0,0,0,0,0,0,0,0,0,0,0,0,0,0,0,0,0,0,0,0,0,0,0,0,0,"Celebrations/ corporate events; Educational tours/ classes; Farm meals (lunches, dinners, etc.); Family/ youth activities;  Pick Your Own/U-Pick operation; Hay rides; Corn maze; Pony rides; ",1,1,1,1,1,0,0,1,1,0,1,Hand washing station(s); Picnic areas with tables; ,1,0,0,1,0,1,0,1,1
4003376,,2014-11-02 10:36:17,2014-11-02 10:36:17,14679 5875 Rd,Montrose,Colorado,08,81403,DELYAKS,www.yakmeat.us,,,01/01/2014 to 12/31/2014,,By appointment only,"Non-poultry meat; Yak meat (all cuts), Yak bones, Yak wool (raw), Yak skulls, Yak tails, Yak Hides;",,,,,,,,,,,,,0,0,0,0,0,0,0,0,0,0,0,0,0,0,0,0,0,0,0,0,0,0,0,1,0,0,0,0, Other: Pasture visits to potential Yak buyers;,0,0,0,0,0,0,0,0,0,0,0,,0,0,0,0,1,1,0,0,0
4016006,,2014-09-16 13:22:56,2014-09-16 13:22:56,66 Lee Road (route 155),Lee,New Hampshire,33,3861,Demeritt Hill Farm,www.demeritthillfarm.com,https://www.facebook.com/pages/DeMeritt-Hill-Farm/166676763359982?ref=bookmarks,https://twitter.com/NHapples,08/23/2014 to 12/31/2014,Mon: 10:00 AM - 6:00 PM;Tue: 10:00 AM - 6:00 PM;Wed: 10:00 AM - 6:00 PM;Thu: 10:00 AM - 6:00 PM;Fri: 10:00 AM - 6:00 PM;Sat: 10:00 AM - 6:00 PM;Sun: 10:00 AM - 6:00 PM;,Please call or visit our website for updated hours,Baked goods; Canned or preserved food; Coffee and/or tea; Crafts and/or woodworking items; Cut flowers; Fresh fruits; Fresh vegetables; Honey; Juices; Maple products; Nursery stock; Prepared foods; Soap;,,,,,,,,,,,,,1,0,1,1,1,1,0,0,0,0,0,1,1,0,1,1,1,0,1,0,0,0,1,0,1,0,0,0,"Celebrations/ corporate events; Educational tours/ classes; Farm meals (lunches, dinners, etc.); Family/ youth activities;  Pick Your Own/U-Pick operation; Tours of manufacturing facilities; Hay rides; Petting zoo; Pony rides;  Other: Enchanted Hayrides (non - frightening), Haunted Overload Halloween Haunt, Reason for the Season;",1,1,1,1,1,1,0,1,0,1,1,Hand washing station(s); Flush toilets; Picnic areas without tables; Picnic areas with tables; ,1,1,1,1,0,1,1,1,0
4013012,,2014-07-26 19:42:03,,1576 Sea Island Parkway ,Saint Helena Island,South Carolina,45,29920,Dempsey Farms UPick,dempseyfarmsupick.com,,,,,,,,,,,,,,,,,,,0,0,0,0,0,0,0,0,0,0,0,0,0,0,0,0,0,0,0,0,0,0,0,0,0,0,0,0,,,,,,,,,,,,,,,,,,,,,,
4017194,2014-08-15 11:52:44,2014-08-15 11:58:12,2014-08-15 11:58:12,16870- Garvin Mesa Road,Paonia,Colorado,08,81428,"Desert Weyr, LLC",http://www.desertweyr.com,https://www.facebook.com/pages/Desert-Weyr-LLC/56496179294,https://twitter.com/Oogiem,05/31/2014 to 09/28/2014,Fri: 11:00 AM - 4:00 PM;Sat: 11:00 AM - 4:00 PM;Sun: 11:00 AM - 4:00 PM;,Also by apt. year round,Poultry products; Non-poultry meat;,,,,,,,,,,,,,0,0,0,0,0,0,0,0,0,0,0,0,0,0,0,0,0,0,0,0,0,1,0,1,0,0,0,0, Other: farm tours;,0,0,0,0,0,0,0,0,0,0,0,Flush toilets; ,0,1,0,0,0,1,1,1,0
4003454,,2014-09-30 11:42:24,,13078 Windy Hollow,Brighton Township,Michigan,26,48380,Destiny Farm- FarmStand,,,,,,,,,,,,,,,,,,,,0,0,0,0,0,0,0,0,0,0,0,0,0,0,0,0,0,0,0,0,0,0,0,0,0,0,0,0,,,,,,,,,,,,,,,,,,,,,,
4017208,2014-08-20 20:02:19,2014-08-20 20:10:46,2014-08-20 20:10:46,771 Hwy 150,"Reidsville,",North Carolina,37,27320,Devil Dog Orchard,,,,08/15/2014 to 09/30/2014,Mon: 9:00 AM - 7:00 PM;Tue: 9:00 AM - 7:00 PM;Wed: 9:00 AM - 7:00 PM;Thu: 9:00 AM - 7:00 PM;Fri: 9:00 AM - 7:00 PM;Sat: 9:00 AM - 7:00 PM;,,Fresh fruits;,,,,,,,,,,,,,0,0,0,0,0,0,0,0,0,0,0,1,0,0,0,0,0,0,0,0,0,0,0,0,0,0,0,0,Pick Your Own/U-Pick operation; ,0,0,0,0,1,0,0,0,0,0,0,,0,0,0,0,0,1,0,0,0
4012986,,2014-09-14 15:21:40,2014-09-14 15:21:40,54 Joy Road,Woodstock,Connecticut,09,6281,Devon Point Farm,http://www.devonpointfarm.com,,,06/10/2014 to 10/31/2014,Tue: 3:00 PM - 7:00 PM;Fri: 3:00 AM - 7:00 PM;,,,,,,,,,,,,,,,0,0,0,0,0,0,0,0,0,0,0,0,0,0,0,0,0,0,0,0,0,0,0,0,0,0,0,0,Family/ youth activities;  ,0,0,0,1,0,0,0,0,0,0,0,,0,0,0,0,0,1,1,1,0
4004399,,2014-08-14 18:32:32,2014-08-14 18:32:32,5619 FM 1624,Lexington,Texas,48,78947,Dewberry Hills Farm,www.dhfarms.com,https://www.facebook.com/pages/Dewberry-Hills-Farm/282475245128234,,01/01/2014 to 12/31/2014,,,Poultry products;,,,,,,,,,,,,,0,0,0,0,0,0,0,0,0,0,0,0,0,0,0,0,0,0,0,0,0,1,0,0,0,0,0,0,Educational tours/ classes; Tours of manufacturing facilities; ,0,1,0,0,0,1,0,0,0,0,0,Flush toilets; ,0,1,0,0,0,1,1,0,0
4003653,,2014-07-26 22:59:06,2014-07-26 22:59:06,2685 Dickie Road,Roseland,Virginia,51,22967,Dickie Bros. Orchard,dickiebros.com,,,08/25/2014 to 11/30/2014,Mon: 10:00 AM - 5:00 PM;Tue: 10:00 AM - 5:00 PM;Wed: 10:00 AM - 5:00 PM;Thu: 10:00 AM - 5:00 PM;Fri: 10:00 AM - 5:00 PM;Sat: 10:00 AM - 5:00 PM;Sun: 10:00 AM - 5:00 PM;,,Canned or preserved food; Crafts and/or woodworking items; Fresh fruits; Fresh vegetables; Honey; Juices;,,,,,,,,,,,,,0,0,1,0,1,0,0,0,0,0,0,1,1,0,1,1,0,0,0,0,0,0,0,0,0,0,0,0,Pick Your Own/U-Pick operation; ,0,0,0,0,1,0,0,0,0,0,0,Hand washing station(s); Flush toilets; Picnic areas with tables; ,1,1,0,1,0,1,1,1,0
4012975,,2014-07-30 18:13:37,2014-07-30 18:13:37,16678 West Aptakisic Road,Prairie View,Illinois,17,60069,Didier Farms,www.didierfarms.com,https://www.facebook.com/pages/Didier-Farms/120890817921408,,07/11/2014 to 10/31/2014,Mon: 9:00 AM - 6:00 PM;Tue: 9:00 AM - 6:00 PM;Wed: 9:00 AM - 6:00 PM;Thu: 9:00 AM - 6:00 PM;Fri: 9:00 AM - 6:00 PM;Sat: 9:00 AM - 6:00 PM;Sun: 9:00 AM - 6:00 PM;,,Baked goods; Bedding plants; Canned or preserved food; Herbs; Fresh fruits; Honey; Juices; Nuts; Poultry products; Prepared foods; Non-poultry meat;,,,,,,,,,,,,,1,1,1,0,0,0,0,0,0,0,1,1,0,0,1,1,0,0,0,1,0,1,1,1,0,0,0,0,"Celebrations/ corporate events; Educational tours/ classes; Pick Your Own/U-Pick operation; Hay rides; Corn maze; Petting zoo; Pony rides;  Other: crafts,playground.Some activities only during Pumpkinfest Sept-Oct;",1,1,0,0,1,0,0,1,1,1,1,Hand washing station(s); Picnic areas with tables; ,1,0,0,1,0,1,0,1,0
4017243,2014-08-22 17:42:17,2014-08-22 17:46:25,2014-08-22 17:46:25,1028 Main Rd,Chatham ,New Hampshire,33,03813,Dietz's Farm,,,,,,,Eggs;,06/01/2015 to 09/15/2015,,,Eggs;,,,,,,,,,0,0,0,0,0,0,0,0,1,0,0,0,0,0,0,0,0,0,0,0,0,0,0,0,0,0,0,0,,0,0,0,0,0,0,0,0,0,0,0,,0,0,0,0,0,0,0,0,0
4017335,2014-08-28 07:10:41,2014-08-28 07:24:55,2014-08-28 07:24:55,,Richardsville,Virginia,51,22736,Digging Dog Farm,www.thediggingdogfarm.com,,,01/01/2014 to 12/31/2014,Mon: 8:00 AM - 6:00 PM;Tue: 8:00 AM - 6:00 PM;Wed: 8:00 AM - 6:00 PM;Thu: 8:00 AM - 6:00 PM;Fri: 8:00 AM - 6:00 PM;Sat: 8:00 AM - 6:00 PM;Sun: 8:00 AM - 6:00 PM;,,,,,,,,,,,,,,,0,0,0,0,0,0,0,0,0,0,0,0,0,0,0,0,0,0,0,0,0,0,0,0,0,0,0,0, Other: Tours by request;,0,0,0,0,0,0,0,0,0,0,0,,0,0,0,0,1,1,0,0,0
4012973,,2014-07-28 09:39:29,2014-07-28 09:39:29,3101 Nesco Road,Hammonton,New Jersey,34,08037,DiMeo's PYO Blueberry Farms & Non-GMO Organic Berry Bushes Nursery,http://www.DiMeoFarms.com,http://www.facebook.com/pages/DiMeo-Fruit-Farms-Organic-Berry-Plant-Nursery/199028993454562,http://twitter.com/dimeofarms,01/01/2014 to 12/31/2014,Mon: 10:00 AM - 5:00 PM;Tue: 10:00 AM - 5:00 PM;Wed: 10:00 AM - 5:00 PM;Thu: 10:00 AM - 5:00 PM;Fri: 10:00 AM - 5:00 PM;Sat: 10:00 AM - 5:00 PM;Sun: 1:00 PM - 5:00 PM;,,Bedding plants; Canned or preserved food; Crafts and/or woodworking items; Cut flowers; Fresh fruits; Honey; Juices; Nursery stock; Poultry products;,,,,,,,,,,,,,0,1,1,0,1,1,0,0,0,0,0,1,0,0,1,1,0,0,1,0,0,1,0,0,0,0,0,0,"Celebrations/ corporate events; Educational tours/ classes; Farm meals (lunches, dinners, etc.); Family/ youth activities;  Pick Your Own/U-Pick operation; Tours of manufacturing facilities; Hay rides; Petting zoo;  Other: Farm wedding venue in New Jersey for Farm Weddings;",1,1,1,1,1,1,0,1,0,1,0,Hand washing station(s); Flush toilets; Picnic areas without tables; Picnic areas with tables; ,1,1,1,1,0,1,1,0,0
4017574,2014-12-28 11:15:50,2014-12-28 11:27:59,2014-12-28 11:27:59,47402 228th Ave SE,Enumclaw,Washington,53,98022,Dinkelman Worm Farm,Dinkelman Wormfarm,,,01/01/2014 to 12/31/2014,,Open by appointment,"Bedding plants; Eggs; Nursery stock; vermicompost  and composting worms , red wigglers, worm tea, local baled hay;",,,,,,,,,,,,,0,1,0,0,0,0,0,0,1,0,0,0,0,0,0,0,0,0,1,0,0,0,0,0,0,0,0,0,Educational tours/ classes;  Other: worm farm demo strations and fabrication of bins.;,0,1,0,0,0,0,0,0,0,0,0,,0,0,0,0,1,1,1,0,0
4017479,2014-09-28 18:32:52,2014-09-28 18:49:24,2014-09-28 18:49:24,3823 Sanderson Road,Erieville,New York,36,13061,Dizzy Lizzie's Farm,www.dizzylizziesfarm@gmail.com,https://www.facebook.com/dizzylizziesfarm?ref=hl,,07/01/2014 to 10/15/2014,Mon: 10:00 AM - 5:00 PM;Tue: 10:00 AM - 5:00 PM;Fri: 10:00 AM - 5:00 PM;Sun: 10:00 AM - 5:00 PM;,,Bedding plants; Cut flowers; Dry beans; Eggs; Herbs; Fresh fruits; Fresh vegetables; Maple products;,,,,,,,,,,,,,0,1,0,0,0,1,0,1,1,0,1,1,1,0,0,0,1,0,0,0,0,0,0,0,0,0,0,0,Educational tours/ classes; Pick Your Own/U-Pick operation; Tours of manufacturing facilities; ,0,1,0,0,1,1,0,0,0,0,0,Picnic areas with tables; ,0,0,0,1,0,1,1,0,0
4017299,2014-08-25 20:40:27,2014-08-25 20:57:43,2014-08-25 20:57:43,41900 NE Dobler Hill Road,Woodland,Washington,53,98674,"Dobler Hill Dairy, LLC",www.doblerhilldairy.com,,,01/01/2014 to 12/31/2014,Mon: 9:00 AM - 8:00 PM;Tue: 9:00 AM - 8:00 PM;Wed: 9:00 AM - 8:00 PM;Thu: 9:00 AM - 8:00 PM;Fri: 9:00 AM - 8:00 PM;Sat: 9:00 AM - 8:00 PM;,,Dairy products;,,,,,,,,,,,,,0,0,0,0,0,0,1,0,0,0,0,0,0,0,0,0,0,0,0,0,0,0,0,0,0,0,0,0, Other: Customers are welcome to watch milking process;,0,0,0,0,0,0,0,0,0,0,0,,0,0,0,0,1,1,0,0,0
4017372,2014-09-02 11:33:36,2014-09-02 12:04:57,2014-09-02 12:04:57,31140 185th Street,Honey Creek,Iowa,19,51542,"Doe's and Diva's Dairy, Inc.",www.doesanddivas.com,https://www.facebook.com/pages/Does-and-Divas-Dairy,https://twitter.com/Does_and_Divas,04/06/2015 to 10/30/2015,Tue: 9:00 AM - 4:00 PM;Wed: 9:00 AM - 4:00 PM;Thu: 9:00 AM - 4:00 PM;Fri: 9:00 AM - 4:00 PM;Sat: 9:00 AM - 3:00 PM;Sun: 9:00 AM - 4:00 PM;,,Dairy products; Eggs; Poultry products;,,,,,,,,,,,,,0,0,0,0,0,0,1,0,1,0,0,0,0,0,0,0,0,0,0,0,0,1,0,0,0,0,0,0,Educational tours/ classes; Family/ youth activities;  Tours of manufacturing facilities; ,0,1,0,1,0,1,0,0,0,0,0,Hand washing station(s); Flush toilets; ,1,1,0,0,0,1,1,0,0
4014469,,2014-07-27 16:07:53,2014-07-27 16:07:53,22509 S Stormer Rd,Estacada,Oregon,41,97023,Don Smith Tree Farm,,,,to 08/30/2014,Mon: 7:00 AM - 4:00 PM;Tue: 7:00 AM - 4:00 PM;Wed: 7:00 AM - 4:00 PM;Thu: 7:00 AM - 4:00 PM;Fri: 7:00 AM - 4:00 PM;Sat: 7:00 AM - 4:00 PM;,CLOSED Sunday,Fresh fruits;,,,,,,,,,,,,,0,0,0,0,0,0,0,0,0,0,0,1,0,0,0,0,0,0,0,0,0,0,0,0,0,0,0,0,Pick Your Own/U-Pick operation; ,0,0,0,0,1,0,0,0,0,0,0,Hand washing station(s); Flush toilets; ,1,1,0,0,0,1,1,0,0
4012943,,2014-08-21 12:10:57,2014-08-21 12:10:57,11827 Reiner Road,Monroe,Washington,53,98272,Donnellys Riverbank Blueberries,,,,06/01/2014 to 10/15/2014,Mon: 7:00 AM - 7:00 PM;Tue: 7:00 AM - 7:00 PM;Wed: 7:00 AM - 7:00 PM;Thu: 7:00 AM - 7:00 PM;Fri: 7:00 AM - 7:00 PM;Sat: 7:00 AM - 7:00 PM;Sun: 7:00 AM - 7:00 PM;,,Fresh fruits; Fresh vegetables;,,,,,,,,,,,,,0,0,0,0,0,0,0,0,0,0,0,1,1,0,0,0,0,0,0,0,0,0,0,0,0,0,0,0,Pick Your Own/U-Pick operation; ,0,0,0,0,1,0,0,0,0,0,0,Hand washing station(s); Flush toilets; Picnic areas with tables; ,1,1,0,1,0,1,1,0,0
4004244,,2014-07-31 10:16:10,2014-07-31 10:16:10,W8707 Sawmill Rd,Blanchardville,Wisconsin,55,53516,Dorothy's Grange LLC,dorothysgrange.com,,,01/01/2014 to 12/31/2014,,Please call before visting.,Cut flowers; Herbs; Fresh vegetables; Non-poultry meat;,,,,,,,,,,,,,0,0,0,0,0,1,0,0,0,0,1,0,1,0,0,0,0,0,0,0,0,0,0,1,0,0,0,0,Educational tours/ classes;  Other: Farm Stays.;,0,1,0,0,0,0,0,0,0,0,0,,0,0,0,0,1,1,1,0,0
4017476,2014-09-26 00:08:39,2014-09-26 00:23:06,2014-09-26 00:23:06,22440 County Road 1,Berthoud ,Colorado,08,80513,Dottie's Garden Spot,,,,01/01/2014 to 12/31/2014,Mon: 8:00 AM - 4:00 PM;Tue: 8:00 AM - 4:00 PM;Wed: 8:00 AM - 4:00 PM;Thu: 8:00 AM - 4:00 PM;Fri: 8:00 AM - 4:00 PM;Sat: 8:00 AM - 4:00 PM;Sun: 12:00 PM - 4:00 PM;,,Fresh vegetables;,,,,,,,,,,,,,0,0,0,0,0,0,0,0,0,0,0,0,1,0,0,0,0,0,0,0,0,0,0,0,0,0,0,0,Educational tours/ classes; ,0,1,0,0,0,0,0,0,0,0,0,,0,0,0,0,1,1,1,1,0
4016829,,2014-07-26 22:37:56,2014-07-26 22:37:56,345 Rose Court corner of Doak and Highland,Ripon,California,06,95366,Double Dutch Farms,,https://www.facebook.com/pages/Pom-Girl/158669604180922?fref=nf,,,Tue: 7:00 AM - 7:00 PM;Thu: 7:00 AM - 7:00 PM;Sat: 7:00 AM - 7:00 PM;Sun: 12:00 PM - 7:00 PM;,Lease call to make appointment for u pick or deliveries on Friday Saturday or Monday.,Canned or preserved food; Cut flowers; Eggs; Herbs; Fresh fruits; Fresh vegetables; Grains and/or flour; Honey; Nuts; Soap;,,,,,,,,,,,,,0,0,1,0,0,1,0,0,1,0,1,1,1,1,1,0,0,0,0,1,0,0,0,0,1,0,0,0,"Celebrations/ corporate events; Educational tours/ classes; Pick Your Own/U-Pick operation;  Other: Horse training, special events, horse rentals, lessons. Play days in the garden.;",1,1,0,0,1,0,0,0,0,0,0,Hand washing station(s); Picnic areas with tables; ,1,0,0,1,0,1,0,0,0
4003033,,2014-08-01 10:13:04,2014-08-01 10:13:04,823 1400 Lane,Delta,Colorado,08,81416,Dragonfly Farm,dragonflychurros.com,,,03/01/2014 to 08/01/2014,Mon: 10:00 AM - 2:00 PM;Tue: 10:00 AM - 2:00 PM;Wed: 10:00 AM - 2:00 PM;Thu: 10:00 AM - 2:00 PM;Fri: 10:00 AM - 2:00 PM;Sat: 10:00 AM - 2:00 PM;,,,,,,,,,,,,,,,0,0,0,0,0,0,0,0,0,0,0,0,0,0,0,0,0,0,0,0,0,0,0,0,0,0,0,0,,0,0,0,0,0,0,0,0,0,0,0,,0,0,0,0,0,1,1,0,0
4001165,,2014-08-20 22:20:18,2014-08-20 22:20:18,16259 Trainham Road,Beaverdam,Virginia,51,23015,Dragonfly Farms,www.dragonflyfarms.com,https://www.facebook.com/dragonflyfarms,,01/01/2014 to 12/31/2014,,open by appointment. please call ahead.,Non-poultry meat;,,,,,,,,,,,,,0,0,0,0,0,0,0,0,0,0,0,0,0,0,0,0,0,0,0,0,0,0,0,1,0,0,0,0,,0,0,0,0,0,0,0,0,0,0,0,Hand washing station(s); Flush toilets; Picnic areas with tables; ,1,1,0,1,0,1,1,1,0
4001161,,2014-07-26 21:43:07,,13050 Bell Lane,Meadowview,Virginia,51,24361,Dreamland Alpacas ,,https://www.facebook.com/DreamlandAlpacasLLC,,,,,,,,,,,,,,,,,,0,0,0,0,0,0,0,0,0,0,0,0,0,0,0,0,0,0,0,0,0,0,0,0,0,0,0,0,,,,,,,,,,,,,,,,,,,,,,
4017387,2014-09-04 07:15:34,2014-09-04 07:22:05,2014-09-04 07:22:05,541 Strawberry Lane,Wakefield,Virginia,51,23888,Drewry Farm,www.drewryfarms.com,www.facebook.com-Drewry.Farm.Blueberries,,04/01/2015 to 09/01/2015,Wed: 8:00 AM - 7:00 PM;Fri: 8:00 AM - 7:00 PM;Sat: 8:00 AM - 7:00 PM;,Beef and Pork available year round.,Eggs; Fresh fruits; Fresh vegetables;,,,,,,,,,,,,,0,0,0,0,0,0,0,0,1,0,0,1,1,0,0,0,0,0,0,0,0,0,0,0,0,0,0,0,Celebrations/ corporate events; Educational tours/ classes; Pick Your Own/U-Pick operation; ,1,1,0,0,1,0,0,0,0,0,0,Hand washing station(s); Picnic areas with tables; ,1,0,0,1,0,1,1,1,0
4004236,,2014-07-29 14:29:07,2014-07-29 14:29:07,52203 E. Terra Fern Road,Sandy,Oregon,41,97055,Drumcliffe Farm,,,,,,,,,,,,,,,,,,,,0,0,0,0,0,0,0,0,0,0,0,0,0,0,0,0,0,0,0,0,0,0,0,0,0,0,0,0,,0,0,0,0,0,0,0,0,0,0,0,,0,0,0,0,0,0,0,0,0
4001159,,2014-07-26 18:45:31,2014-07-26 18:45:31,16586 Dunbar Road,Mount Vernon,Washington,53,98273,Dunbar Gardens,http://www.dunbargardens.com,https://www.facebook.com/DunbarGardens,,01/01/2014 to 12/31/2014,Mon: 10:00 AM - 5:00 PM;Tue: 10:00 AM - 5:00 PM;Wed: 10:00 AM - 5:00 PM;Thu: 10:00 AM - 5:00 PM;Fri: 10:00 AM - 5:00 PM;Sat: 10:00 AM - 5:00 PM;Sun: 10:00 AM - 5:00 PM;,best to email or call ahead if coming a distance,Crafts and/or woodworking items; Nursery stock;,,,,,,,,,,,,,0,0,0,0,1,0,0,0,0,0,0,0,0,0,0,0,0,0,1,0,0,0,0,0,0,0,0,0,,0,0,0,0,0,0,0,0,0,0,0,,0,0,0,0,1,1,1,1,0
4004231,,2014-07-26 19:49:25,2014-07-26 19:49:25,3385 130th St.,Dunlap,Iowa,19,51529,Dunham Bee Farm,www.dunhambeefarm.com,facebook.com/dunhambeefarm,,01/01/2014 to 12/31/2014,Mon: 8:00 AM - 5:00 PM;Tue: 8:00 AM - 5:00 PM;Wed: 8:00 AM - 5:00 PM;Thu: 8:00 AM - 5:00 PM;Fri: 8:00 AM - 5:00 PM;Sat: 8:00 AM - 12:00 PM;,,Honey;,,,,,,,,,,,,,0,0,0,0,0,0,0,0,0,0,0,0,0,0,1,0,0,0,0,0,0,0,0,0,0,0,0,0,,0,0,0,0,0,0,0,0,0,0,0,Hand washing station(s); Flush toilets; ,1,1,0,0,0,1,1,1,0
4003233,,2014-07-29 11:22:45,2014-07-29 11:22:45,"Mile 1, Forest Rd 234",Magdalena,New Mexico,35,87825,Dunhill Ranch All-Natural Grass-Fed Lamb,www.dunhillranch.com,,,09/01/2014 to 12/31/2014,Mon: 9:00 AM - 5:00 PM;Tue: 9:00 AM - 5:00 PM;Wed: 9:00 AM - 5:00 PM;Thu: 9:00 AM - 5:00 PM;Fri: 9:00 AM - 5:00 PM;Sat: 9:00 AM - 5:00 PM;Sun: 9:00 AM - 5:00 PM;,Please call beforehand to ensure that we are here and have lamb in stock.,Non-poultry meat;,,,,,,,,,,,,,0,0,0,0,0,0,0,0,0,0,0,0,0,0,0,0,0,0,0,0,0,0,0,1,0,0,0,0,,0,0,0,0,0,0,0,0,0,0,0,Hand washing station(s); Flush toilets; ,1,1,0,0,0,1,1,0,0
4013324,,2014-08-18 12:56:02,2014-08-18 12:56:02,6967 109th Avenue,South Haven,Michigan,26,49090,Dutch Farm Market,,https://www.facebook.com/pages/Dutch-Farm-Market/270598596340448,,05/08/2014 to 07/04/2014,Mon: 9:00 AM - 6:00 PM;Tue: 9:00 AM - 6:00 PM;Wed: 9:00 AM - 6:00 PM;Thu: 9:00 AM - 6:00 PM;Fri: 9:00 AM - 6:00 PM;Sat: 9:00 AM - 6:00 PM;Sun: 9:00 AM - 6:00 PM;,,Baked goods; Canned or preserved food; Crafts and/or woodworking items; Dairy products; Eggs; Herbs; Fresh fruits; Fresh vegetables; Honey; Juices; Maple products;,07/05/2014 to 08/31/2014,Mon: 8:00 AM - 7:00 PM;Tue: 8:00 AM - 7:00 PM;Wed: 8:00 AM - 7:00 PM;Thu: 8:00 AM - 7:00 PM;Fri: 8:00 AM - 7:00 PM;Sat: 8:00 AM - 7:00 PM;Sun: 8:00 AM - 7:00 PM;,,Baked goods; Canned or preserved food; Coffee and/or tea; Crafts and/or woodworking items; Cut flowers; Dairy products; Eggs; Herbs; Fresh fruits; Fresh vegetables; Honey; Juices; Maple products;,09/01/2014 to 10/31/2014,Mon: 9:00 AM - 6:00 PM;Tue: 9:00 AM - 6:00 PM;Wed: 9:00 AM - 6:00 PM;Thu: 9:00 AM - 6:00 PM;Fri: 9:00 AM - 6:00 PM;Sat: 9:00 AM - 6:00 PM;Sun: 9:00 AM - 6:00 PM;,,Baked goods; Canned or preserved food; Coffee and/or tea; Crafts and/or woodworking items; Cut flowers; Dairy products; Eggs; Herbs; Fresh fruits; Fresh vegetables; Honey; Juices; Maple products;,,,,,1,0,1,1,1,1,1,0,1,0,1,1,1,0,1,1,1,0,0,0,0,0,0,0,0,0,0,0,Pick Your Own/U-Pick operation; ,0,0,0,0,1,0,0,0,0,0,0,Hand washing station(s); Flush toilets; Picnic areas without tables; Picnic areas with tables; ,1,1,1,1,0,1,1,0,0
4004556,,2014-07-30 09:20:52,2014-07-30 09:20:52,10309 Lafferty road,Mt Pleasant,Arkansas,05,72561,earthartandfoods.com,earthartandfoods.com,,,,,,,,,,,,,,,,,,,0,0,0,0,0,0,0,0,0,0,0,0,0,0,0,0,0,0,0,0,0,0,0,0,0,0,0,0,,0,0,0,0,0,0,0,0,0,0,0,,0,0,0,0,1,1,0,1,0
4013036,,2014-07-26 19:32:52,2014-07-26 19:32:52,4983 Ferndale Road,Ferndale,Washington,53,98248,Eastview Blueberry Farm Inc.,www.eastviewblueberryfarm.com/,,,07/19/2014 to 08/30/2014,Mon: 9:00 AM - 5:00 PM;Tue: 9:00 AM - 5:00 PM;Wed: 9:00 AM - 5:00 PM;Thu: 9:00 AM - 5:00 PM;Fri: 9:00 AM - 5:00 PM;Sat: 9:00 AM - 5:00 PM;Sun: 9:00 AM - 5:00 PM;,,Fresh fruits;,01/01/2014 to 12/31/2014,,Frozen Blueberries available year round,,,,,,,,,,0,0,0,0,0,0,0,0,0,0,0,1,0,0,0,0,0,0,0,0,0,0,0,0,0,0,0,0,Pick Your Own/U-Pick operation; ,0,0,0,0,1,0,0,0,0,0,0,Hand washing station(s); Flush toilets; ,1,1,0,0,0,1,1,0,0
4001141,,2014-07-30 14:04:13,2014-07-30 14:04:13,16430 SW Holly Hill Road,Hillsboro,Oregon,41,97123,EasyGo Farm,http://easygofarm.net,https://www.facebook.com/easygofarm,,01/01/2014 to 12/31/2014,,"As long as we're home, we're open. Please phone or email to let us know when you'd like to visit.",Crafts and/or woodworking items;,,,,,,,,,,,,,0,0,0,0,1,0,0,0,0,0,0,0,0,0,0,0,0,0,0,0,0,0,0,0,0,0,0,0, Other: Informal visits with alpacas.;,0,0,0,0,0,0,0,0,0,0,0,,0,0,0,0,0,1,1,1,0
4015825,,2014-07-26 18:12:02,2014-07-26 18:12:02,7235 FM 607,Brownsboro,Texas,48,75778,Echo Springs Blueberry Farm,www.echospringsblueberyfarm.com,,,05/29/2015 to 08/01/2015,Mon: 7:00 AM - 4:00 PM;Tue: 7:00 AM - 4:00 PM;Wed: 7:00 AM - 4:00 PM;Thu: 7:00 AM - 4:00 PM;Fri: 7:00 AM - 4:00 PM;Sat: 7:00 AM - 4:00 PM;Sun: 7:00 AM - 4:00 PM;,,Baked goods; Bedding plants; Canned or preserved food; Coffee and/or tea; Crafts and/or woodworking items; Herbs; Fresh fruits; Fresh vegetables; Grains and/or flour; Honey; Juices; Maple products; Nursery stock; Prepared foods; Soap;,,,,,,,,,,,,,1,1,1,1,1,0,0,0,0,0,1,1,1,1,1,1,1,0,1,0,0,0,1,0,1,0,0,0,Educational tours/ classes; Family/ youth activities;  Pick Your Own/U-Pick operation; Tours of manufacturing facilities; ,0,1,0,1,1,1,0,0,0,0,0,Hand washing station(s); Picnic areas without tables; Picnic areas with tables; ,1,0,1,1,0,1,1,1,0
4002975,,2014-09-30 12:39:18,2014-09-30 12:39:18,82-5889 Old Government Rd.,Captain Cook,Hawaii,15,96704,Edge of the World,www.konaedge.com,,,01/01/2014 to 12/31/2014,Mon: 9:00 AM - 5:00 PM;Tue: 9:00 AM - 5:00 PM;Wed: 9:00 AM - 5:00 PM;Thu: 9:00 AM - 5:00 PM;Fri: 9:00 AM - 5:00 PM;Sat: 9:00 AM - 5:00 PM;Sun: 9:00 AM - 5:00 PM;,Please telephone before coming.  Mahalo.,Coffee and/or tea; Fresh fruits; Nuts; Wild harvested forest products;,,,,,,,,,,,,,0,0,0,1,0,0,0,0,0,0,0,1,0,0,0,0,0,0,0,1,0,0,0,0,0,0,1,0,Pick Your Own/U-Pick operation; ,0,0,0,0,1,0,0,0,0,0,0,,0,0,0,0,1,1,1,0,0
4017551,2014-11-06 08:27:24,2014-11-06 08:33:44,2014-11-06 08:33:44,348 Angola Road,Cornwall,New York,36,12518,Edgwick Farm,,https://www.facebook.com/edgwickfarm,,01/01/2015 to 10/01/2015,Mon: 7:00 AM - 9:00 AM;Tue: 7:00 AM - 9:00 AM;Wed: 7:00 AM - 9:00 AM;Thu: 7:00 AM - 9:00 AM;Fri: 7:00 AM - 9:00 AM;Sat: 7:00 AM - 9:00 AM;Sun: 7:00 AM - 9:00 AM;,"Also 5 to 7 pm, daily and by appointment.",Dairy products; Eggs;,,,,,,,,,,,,,0,0,0,0,0,0,1,0,1,0,0,0,0,0,0,0,0,0,0,0,0,0,0,0,0,0,0,0,Educational tours/ classes; Tours of manufacturing facilities; ,0,1,0,0,0,1,0,0,0,0,0,Hand washing station(s); Flush toilets; ,1,1,0,0,0,1,1,1,0
