OF_ID,createTime,updateTime,finishTime,Location_ST,Location_City,Location_State,Location_StateFIPS,Location_Zip,marketname,Market_Website,Market_Facebook,Market_Twitter,season1_date,season1_time,season1_notes,season1_products,season2_date,season2_time,season2_notes,season2_products,season3_date,season3_time,season3_notes,season3_products,season4_date,season4_time,season4_notes,season4_products,Product_1,Product_2,Product_3,Product_4,Product_5,Product_6,Product_7,Product_8,Product_9,Product_10,Product_11,Product_12,Product_13,Product_14,Product_15,Product_16,Product_17,Product_18,Product_19,Product_20,Product_21,Product_22,Product_23,Product_24,Product_25,Product_26,Product_27,Product_28,ActivityList,Activity_1,Activity_2,Activity_3,Activity_4,Activity_5,Activity_6,Activity_7,Activity_8,Activity_9,Activity_10,Activity_11,FacilitiesList,Facilities_1,Facilities_2,Facilities_3,Facilities_4,Facilities_5,Payment_2,Payment_3,Payment_4,Payment_1
4017502,2014-10-06 08:24:19,2014-10-06 09:09:53,2014-10-06 09:09:53,4680 US HWY 15-501,Carthage ,North Carolina,37,28327,Karefree Produce,www.karefreeproduce.com,https://www.facebook.com/pages/Karefree-Produce,,04/01/2014 to 12/24/2014,Tue: 9:00 AM - 5:00 PM;Wed: 9:00 AM - 5:00 PM;Thu: 9:00 AM - 5:00 PM;Fri: 9:00 AM - 5:00 PM;Sat: 9:00 AM - 5:00 PM;,We open in the Spring with strawberries and during that season we are open Tuesday through Saturday 8-6 and Sunday 11-3.,Baked goods; Bedding plants; Canned or preserved food; Crafts and/or woodworking items; Eggs; Fresh fruits; Fresh vegetables; Honey; Maple products; Nursery stock; Nuts; Poultry products; Prepared foods;,,,,,,,,,,,,,1,1,1,0,1,0,0,0,1,0,0,1,1,0,1,0,1,0,1,1,0,1,1,0,0,0,0,0,Pick Your Own/U-Pick operation; ,0,0,0,0,1,0,0,0,0,0,0,Flush toilets; Picnic areas with tables; ,0,1,0,1,0,1,1,0,0
4015385,,2014-07-28 12:06:00,2014-07-28 12:06:00,4781 Powell Road,Kewadin,Michigan,26,49648,Kastanu Farm,kastanufarm@aol.com,,,09/24/2014,Fri: 9:00 AM - 6:00 PM;Sat: 9:00 AM - 6:00 PM;Sun: 9:00 AM - 6:00 PM;,,Nuts;,,,,,,,,,,,,,0,0,0,0,0,0,0,0,0,0,0,0,0,0,0,0,0,0,0,1,0,0,0,0,0,0,0,0,,0,0,0,0,0,0,0,0,0,0,0,Hand washing station(s); Flush toilets; ,1,1,0,0,0,1,1,0,0
4003613,,2014-08-27 13:25:04,2014-08-27 13:25:04,18437 Vontay Rd.,Rockville,Virginia,51,23146,Keenbell Farm LLC,www.keenbellfarm.com,www.facebook.com/keenbellfarm,https://www.twitter.com/keenbellfarm,01/01/2014 to 12/31/2014,Fri: 11:00 AM - 7:00 PM;,Available on Additional Days by Appointment - Call or Email,Canned or preserved food; Eggs; Grains and/or flour; Pet food; Poultry products; Non-poultry meat;,,,,,,,,,,,,,0,0,1,0,0,0,0,0,1,0,0,0,0,1,0,0,0,0,0,0,1,1,0,1,0,0,0,0,"Educational tours/ classes; Farm meals (lunches, dinners, etc.); Family/ youth activities;  Tours of manufacturing facilities; Hay rides; Petting zoo; ",0,1,1,1,0,1,0,1,0,1,0,Hand washing station(s); Flush toilets; ,1,1,0,0,0,1,1,1,0
4015368,,2014-07-27 22:45:19,2014-07-27 22:45:19,53 Hill Road,Weiser,Idaho,16,83672,Kelley Orchards,www.kelleyorchards.com,https://www.facebook.com/KelleyOrchards,https://www.twitter.com/KelleyOrchards,08/04/2014 to 10/31/2014,Mon: 8:00 AM - 6:00 PM;Tue: 8:00 AM - 6:00 PM;Wed: 8:00 AM - 6:00 PM;Thu: 8:00 AM - 6:00 PM;Fri: 8:00 AM - 6:00 PM;Sat: 8:00 AM - 6:00 PM;,,Canned or preserved food; Fresh fruits; Fresh vegetables; Honey;,11/01/2014 to 12/20/2014,Mon: 9:00 AM - 5:00 PM;Tue: 9:00 AM - 5:00 PM;Wed: 9:00 AM - 5:00 PM;Thu: 9:00 AM - 5:00 PM;Fri: 9:00 AM - 5:00 PM;Sat: 9:00 AM - 5:00 PM;,,Canned or preserved food; Fresh fruits; Honey;,,,,,,,,,0,0,1,0,0,0,0,0,0,0,0,1,1,0,1,0,0,0,0,0,0,0,0,0,0,0,0,0,Pick Your Own/U-Pick operation; ,0,0,0,0,1,0,0,0,0,0,0,Hand washing station(s); Picnic areas without tables; Picnic areas with tables; ,1,0,1,1,0,1,1,1,0
4015076,,2014-08-16 00:13:20,,31801 223rd Avenue Ne,Arlington,Washington,53,98223,Kelly's Berries,,,,,,,,,,,,,,,,,,,,0,0,0,0,0,0,0,0,0,0,0,0,0,0,0,0,0,0,0,0,0,0,0,0,0,0,0,0,,,,,,,,,,,,,,,,,,,,,,
4003861,,2014-07-30 12:30:47,2014-07-30 12:30:47,4230 White Lilac Rd,Fallbrook,California,06,92028,Kendall Farms,www.kendall-farms.com,https://www.facebook.com/Kendall.Farms,,01/01/2014 to 12/31/2014,,,Cut flowers;,,,,,,,,,,,,,0,0,0,0,0,1,0,0,0,0,0,0,0,0,0,0,0,0,0,0,0,0,0,0,0,0,0,0,,0,0,0,0,0,0,0,0,0,0,0,,0,0,0,0,1,0,0,0,0
4003493,,2014-07-30 15:42:34,,19498 County Road 38,Goshen,Indiana,18,46526,Kercher's Sunrise Orchards,,https://www.facebook.com/pages/Kerchers-Sunrise-Orchards/140862185948471,,,,,,,,,,,,,,,,,,0,0,0,0,0,0,0,0,0,0,0,0,0,0,0,0,0,0,0,0,0,0,0,0,0,0,0,0,,,,,,,,,,,,,,,,,,,,,,
4013813,,2014-11-07 10:07:04,2014-11-07 10:07:04,Mosier Oregon State Road,Mosier,Oregon,41,97040,Keylock Orchard,,,,06/15/2015 to 07/10/2015,Mon: 9:00 AM - 5:00 PM;Tue: 9:00 AM - 5:00 PM;Wed: 9:00 AM - 5:00 PM;Thu: 9:00 AM - 5:00 PM;Fri: 9:00 AM - 6:00 PM;Sat: 9:00 AM - 6:00 PM;Sun: 9:00 AM - 5:00 PM;,,"SWEET CHERRIES   RAINERS, BING,LAMBERT, VANS;",,,,,,,,,,,,,0,0,0,0,0,0,0,0,0,0,0,0,0,0,0,0,0,0,0,0,0,0,0,0,0,0,0,0,Pick Your Own/U-Pick operation; ,0,0,0,0,1,0,0,0,0,0,0,Hand washing station(s); Picnic areas without tables; ,1,0,1,0,0,1,0,1,0
4017520,2014-10-16 00:02:28,2014-10-16 00:18:23,2014-10-16 00:18:23,7000 Westhill Rd.,Valley Springs,California,06,95252,KG Farms,,https://www.facebook.com/KGFarms323,,01/01/2014 to 12/31/2014,,,Eggs; Fresh fruits; Fresh vegetables; Poultry products; Non-poultry meat;,,,,,,,,,,,,,0,0,0,0,0,0,0,0,1,0,0,1,1,0,0,0,0,0,0,0,0,1,0,1,0,0,0,0,,0,0,0,0,0,0,0,0,0,0,0,,0,0,0,0,1,1,1,0,0
4017163,2014-08-06 19:00:33,2014-08-06 19:12:33,2014-08-06 19:12:33,4874 E 1400 N,North Manchester,Indiana,18,46962,Kindys' Organically Grown Produce,,,,04/20/2014 to 10/25/2014,Mon: 8:00 AM - 5:00 PM;Tue: 8:00 AM - 5:00 PM;Wed: 8:00 AM - 5:00 PM;Thu: 8:00 AM - 5:00 PM;Fri: 8:00 AM - 5:00 PM;Sat: 2:00 PM - 5:00 PM;,Market is closed Sundays,Cut flowers; Eggs; Herbs; Fresh fruits; Fresh vegetables;,,,,,,,,,,,,,0,0,0,0,0,1,0,0,1,0,1,1,1,0,0,0,0,0,0,0,0,0,0,0,0,0,0,0,Educational tours/ classes; ,0,1,0,0,0,0,0,0,0,0,0,,0,0,0,0,1,1,1,0,0
4017337,2014-08-28 12:06:07,2014-08-28 12:15:17,2014-08-28 12:15:17,507 Broadway,Kingston,New York,36,12401,Kingston YMCA Farm Project,kingstonymcafarmproject.org,https://www.facebook.com/KingstonYMCAFarmProject,,06/10/2014 to 10/16/2014,Tue: 4:00 PM - 7:00 PM;Thu: 4:00 AM - 7:00 PM;,Tuesdays are a bike towed mobile market.,Cut flowers; Herbs; Fresh fruits; Fresh vegetables;,,,,,,,,,,,,,0,0,0,0,0,1,0,0,0,0,1,1,1,0,0,0,0,0,0,0,0,0,0,0,0,0,0,0,Educational tours/ classes; Family/ youth activities;  ,0,1,0,1,0,0,0,0,0,0,0,Hand washing station(s); Flush toilets; Picnic areas with tables; ,1,1,0,1,0,1,1,1,1
4017258,2014-08-23 16:51:16,2014-08-23 17:30:49,2014-08-23 17:30:49,16602 Farm Road 410 North,Detroit,Texas,48,75436,Kiomatia Blueberry Farm,,https://www.facebook.com/pages/Kiomatia-Blueberry-Farm/437803346331761,,06/01/2014 to 07/12/2014,,,Fresh fruits;,,,,,,,,,,,,,0,0,0,0,0,0,0,0,0,0,0,1,0,0,0,0,0,0,0,0,0,0,0,0,0,0,0,0,Pick Your Own/U-Pick operation; ,0,0,0,0,1,0,0,0,0,0,0,,0,0,0,0,1,1,1,0,0
4017376,2014-09-02 16:11:52,2014-09-02 16:34:19,2014-09-02 16:34:19,3403 N. Balsiger Road,Apollo borough,Pennsylvania,42,15613,Kistaco Farm Market,http://kistacofarm.com/ ,https://www.facebook.com/pages/Kistaco-Farm/151290458223231?fref=ts ,,01/01/2014 to 12/31/2014,Mon: 8:30 AM - 5:00 PM;Tue: 8:30 AM - 5:00 PM;Wed: 8:30 AM - 5:00 PM;Thu: 8:30 AM - 5:00 PM;Fri: 8:30 AM - 5:00 PM;Sat: 8:30 AM - 3:00 PM;,Closed Sunday.,Baked goods; Bedding plants; Canned or preserved food; Coffee and/or tea; Dairy products; Eggs; Herbs; Fresh fruits; Fresh vegetables; Grains and/or flour; Honey; Juices; Maple products; Pet food; Prepared foods; Soap;,,,,,,,,,,,,,1,1,1,1,0,0,1,0,1,0,1,1,1,1,1,1,1,0,0,0,1,0,1,0,1,0,0,0,,0,0,0,0,0,0,0,0,0,0,0,,0,0,0,0,1,1,1,1,1
4003824,,2014-07-29 21:14:33,2014-07-29 20:59:24,8129 Clear Creek Rd.,Parkdale,Oregon,41,97041,Kiyokawa Family Orchards,http://www.kiyokawafamilyorchards.com/,https://www.facebook.com/KiyokawaFamilyOrchards,,08/29/2014 to 12/31/2014,Mon: 10:00 AM - 6:00 PM;Tue: 10:00 AM - 6:00 PM;Wed: 10:00 AM - 6:00 PM;Thu: 10:00 AM - 6:00 PM;Fri: 10:00 AM - 6:00 PM;Sat: 9:00 AM - 6:00 PM;Sun: 9:00 AM - 6:00 PM;,"Fruit Stand open on a self-serve basis from 11-4-14 until 12-31-14, weather permitting.",Baked goods; Canned or preserved food; Fresh fruits; Fresh vegetables; Honey; Juices; Nuts;,,,,,,,,,,,,,1,0,1,0,0,0,0,0,0,0,0,1,1,0,1,1,0,0,0,1,0,0,0,0,0,0,0,0,"Family/ youth activities;  Pick Your Own/U-Pick operation; Hay rides;  Other: Special events weekends in September/October: Desserts Galore 9/20-21, Honeycrisp Harvest 10/4-5, Fiesta Days 10/18-19 and Heirloom Harvest and Hard Cider Tasting weekend 10/25-26.;",0,0,0,1,1,0,0,1,0,0,0,Hand washing station(s); Flush toilets; Picnic areas with tables; ,1,1,0,1,0,1,1,1,0
4017572,2014-12-16 12:54:51,2014-12-16 13:03:52,2014-12-16 13:03:52,11466 W Carson City Rd.,Greenville,Michigan,26,48838,Klackle Orchards,www.klackleorchards.com,www.facebook.com/klackleorchards,www.twitter.com/klackleorchards,07/24/2015 to 08/31/2015,Mon: 8:00 AM - 6:00 PM;Tue: 8:00 AM - 6:00 PM;Wed: 8:00 AM - 6:00 PM;Thu: 8:00 AM - 6:00 PM;Fri: 8:00 AM - 6:00 PM;Sat: 8:00 AM - 6:00 PM;Sun: 8:00 AM - 4:00 PM;,,Baked goods; Canned or preserved food; Coffee and/or tea; Dairy products; Fresh fruits; Fresh vegetables; Honey; Juices; Maple products;,09/01/2015 to 11/01/2015,Mon: 8:00 AM - 6:00 PM;Tue: 8:00 AM - 6:00 PM;Wed: 8:00 AM - 6:00 PM;Thu: 8:00 AM - 6:00 PM;Fri: 8:00 AM - 7:00 PM;Sat: 8:00 AM - 7:00 PM;Sun: 8:00 AM - 6:00 PM;,,"Baked goods; Canned or preserved food; Coffee and/or tea; Dairy products; Fresh fruits; Fresh vegetables; Honey; Juices; Maple products; Prepared foods; Soap; Pumpkins, Squash, Gourds;",11/02/2015 to 11/25/2015,Mon: 8:00 AM - 6:00 PM;Tue: 8:00 AM - 6:00 PM;Wed: 8:00 AM - 6:00 PM;Thu: 8:00 AM - 6:00 PM;Fri: 8:00 AM - 6:00 PM;Sat: 8:00 AM - 6:00 PM;Sun: 8:00 AM - 4:00 PM;,,"Baked goods; Canned or preserved food; Coffee and/or tea; Dairy products; Fresh fruits; Honey; Juices; Maple products; Soap; Pumpkins, Squash, Gourds;",,,,,1,0,1,1,0,0,1,0,0,0,0,1,1,0,1,1,1,0,0,0,0,0,1,0,1,0,0,0,"Celebrations/ corporate events; Educational tours/ classes; Farm meals (lunches, dinners, etc.); Family/ youth activities;  Pick Your Own/U-Pick operation; Tours of manufacturing facilities; Hay rides; Corn maze; Petting zoo; Pony rides; ",1,1,1,1,1,1,0,1,1,1,1,Hand washing station(s); Flush toilets; Picnic areas with tables; ,1,1,0,1,0,1,1,1,1
4015285,,2014-08-26 11:00:05,2014-08-26 11:00:05,1067 Somer Road,Lyons,Michigan,26,48851,KlineKrest Certified Organic Produce,http://www.klinekrestcertifiedorganicproduce.com/,,,06/01/2014 to 11/08/2014,Mon: 9:00 AM - 6:00 PM;Tue: 9:00 AM - 6:00 PM;Wed: 9:00 AM - 6:00 PM;Thu: 9:00 AM - 6:00 PM;Fri: 9:00 AM - 6:00 PM;,"We are open Monday thru Friday 9AM to closing.  Saturday mornings we are at the Portland farmers market in Portland, Mich.  Closed Sundays.",Fresh fruits; Fresh vegetables; Juices; Nuts; Wild harvested forest products;,06/01/2014 to 11/08/2014,Sat: 9:00 AM - 1:00 PM;,"Saturday mornings we are at the Portland Farmers Market in Portland, Mich.  Closed Sundays.",Baked goods; Canned or preserved food; Cut flowers; Herbs; Fresh fruits; Fresh vegetables; Juices; Nuts; Wild harvested forest products;,,,,,,,,,1,0,1,0,0,1,0,0,0,0,1,1,1,0,0,1,0,0,0,1,0,0,0,0,0,0,1,0,Pick Your Own/U-Pick operation; ,0,0,0,0,1,0,0,0,0,0,0,,0,0,0,0,1,1,1,0,1
4017480,2014-09-29 11:32:06,2014-09-29 11:38:50,2014-09-29 11:38:50,931 NE SALZMAN Rd.,Corbett,Oregon,41,97019,Klock Farm,www.klockfarm.com,,,07/20/2014 to 09/01/2014,Fri: 8:00 AM - 1:00 PM;Sat: 8:00 AM - 1:00 PM;Sun: 8:00 AM - 1:00 PM;,,Fresh fruits;,,,,,,,,,,,,,0,0,0,0,0,0,0,0,0,0,0,1,0,0,0,0,0,0,0,0,0,0,0,0,0,0,0,0,"Pick Your Own/U-Pick operation;  Other: Hiking trails, picnic area;",0,0,0,0,1,0,0,0,0,0,0,Hand washing station(s); Picnic areas with tables; ,1,0,0,1,0,1,1,0,0
4015324,,2014-08-25 12:18:23,2014-08-25 12:18:23,19042 Cherry Lane (corner Tucker Rd & Cherry Ln),Tehachapi,California,06,93561,Knaus Apple Ranch,www.knausappleranch.com/,,,09/20/2014 to 11/07/2014,Mon: 9:00 AM - 5:00 PM;Tue: 9:00 AM - 5:00 PM;Wed: 9:00 AM - 5:00 PM;Thu: 9:00 AM - 5:00 PM;Fri: 9:00 AM - 5:00 PM;Sat: 9:00 AM - 5:00 PM;Sun: 9:00 AM - 5:00 PM;,,Baked goods; Canned or preserved food; Crafts and/or woodworking items; Fresh fruits; Honey;,,,,,,,,,,,,,1,0,1,0,1,0,0,0,0,0,0,1,0,0,1,0,0,0,0,0,0,0,0,0,0,0,0,0,Educational tours/ classes; Pick Your Own/U-Pick operation; ,0,1,0,0,1,0,0,0,0,0,0,Hand washing station(s); Picnic areas with tables; ,1,0,0,1,0,1,0,0,0
4015316,,2014-09-16 13:17:34,,3175 North Ridge Road,Vermilion,Ohio,39,44089,Kriegs Strawberry Farm Market,,Marsha Krieg ,,,,,,,,,,,,,,,,,,0,0,0,0,0,0,0,0,0,0,0,0,0,0,0,0,0,0,0,0,0,0,0,0,0,0,0,0,,,,,,,,,,,,,,,,,,,,,,
4017159,2014-08-06 07:04:35,2014-08-06 07:21:06,2014-08-06 07:21:06,1806 Buffalo Creek Rd.,Lost Creek,West Virginia,54,26385,L & M Farms,,https://www.facebook.com/pages/L-M-Farms/168574719871551,,01/01/2014 to 12/31/2014,Mon: 3:00 PM - 7:00 PM;Tue: 3:00 PM - 7:00 PM;Wed: 3:00 PM - 7:00 PM;Thu: 3:00 PM - 7:00 PM;Fri: 3:00 PM - 7:00 PM;Sat: 3:00 PM - 7:00 PM;Sun: 3:00 PM - 7:00 PM;,"These are best times.  Please call before coming- we do have meetings, appointments, etc. to attend from time-to-time.",Bedding plants; Canned or preserved food; Coffee and/or tea; Crafts and/or woodworking items; Eggs; Herbs; Fresh fruits; Fresh vegetables; Honey; Wild harvested forest products;,,,,,,,,,,,,,0,1,1,1,1,0,0,0,1,0,1,1,1,0,1,0,0,0,0,0,0,0,0,0,0,0,1,0,Educational tours/ classes; ,0,1,0,0,0,0,0,0,0,0,0,Hand washing station(s); Picnic areas with tables; ,1,0,0,1,0,1,1,0,0
4017558,2014-11-14 09:17:52,2014-11-14 18:33:55,2014-11-14 18:33:55,16530 Hall Rd,Casnovia,Michigan,26,49318,L& L Bull,llbull,L&LBull ,,04/24/2015 to 10/24/2015,Mon: 9:00 AM - 5:00 PM;Tue: 9:00 AM - 5:00 PM;Wed: 9:00 AM - 5:00 PM;Thu: 9:00 AM - 5:00 PM;Fri: 9:00 AM - 5:00 PM;Sat: 9:00 AM - 2:00 PM;,call for product availability on produce in season,"Eggs; Fresh fruits; Fresh vegetables; retail greenhouse with flowers,perennials, vegetable plants;",,,,,,,,,,,,,0,0,0,0,0,0,0,0,1,0,0,1,1,0,0,0,0,0,0,0,0,0,0,0,0,0,0,0,,0,0,0,0,0,0,0,0,0,0,0,,0,0,0,0,1,1,1,1,1
4000879,,2014-08-26 19:06:43,2014-08-26 19:06:43,12562 Mary Ann Beach Road,Fairhope,Alabama,01,36532,LA Berry Farms Inc,www.weeksbayplantation.com,https://www.facebook.com/laberryfarms,,04/01/2015 to 07/31/2015,Fri: 8:00 AM - 12:00 PM;Sat: 8:00 AM - 12:00 PM;,,Cut flowers; Fresh fruits; Honey;,,,,,,,,,,,,,0,0,0,0,0,1,0,0,0,0,0,1,0,0,1,0,0,0,0,0,0,0,0,0,0,0,0,0,Celebrations/ corporate events; Educational tours/ classes; Pick Your Own/U-Pick operation;  Other: Archery Course;,1,1,0,0,1,0,0,0,0,0,0,,0,0,0,0,0,1,1,1,0
4017557,2014-11-11 09:30:17,2014-11-11 09:47:59,2014-11-11 09:47:59,20620 St. Rt. 676,Marietta,Ohio,39,45750,"Lane's Farm Market and Orchard, LLC",http://www.lanesfarmmarket.com/,,,01/02/2014 to 12/30/2014,Mon: 8:00 AM - 6:00 PM;Tue: 8:00 AM - 7:00 PM;Wed: 8:00 AM - 7:00 PM;Thu: 8:00 AM - 7:00 PM;Fri: 8:00 AM - 7:00 PM;Sat: 9:00 AM - 7:00 PM;,"Winter hours (Nov. 17th 2014 to March 30th 2015) are 8AM to 6PM, Monday-Saturday.",Baked goods; Canned or preserved food; Coffee and/or tea; Dairy products; Eggs; Fresh fruits; Fresh vegetables; Honey; Juices; Maple products; Pet food; Prepared foods; Soap; Wine; Fresh fruits and vegetables are seasonal. Homemade apple butter and apple cider during fall season. ;,,,,,,,,,,,,,1,0,1,1,0,0,1,0,1,0,0,1,1,0,1,1,1,0,0,0,1,0,1,0,1,0,0,1,Pick Your Own/U-Pick operation; Tours of manufacturing facilities; ,0,0,0,0,1,1,0,0,0,0,0,Hand washing station(s); Flush toilets; Picnic areas with tables; ,1,1,0,1,0,1,1,1,1
4015282,,2014-07-28 09:52:07,2014-07-28 09:52:07,236 Charlie Carsom Road,Jonesborough,Tennessee,47,37659,Larry Thompson Farm,,,,05/01/2014 to 10/31/2014,,,Fresh vegetables;,,,,,,,,,,,,,0,0,0,0,0,0,0,0,0,0,0,0,1,0,0,0,0,0,0,0,0,0,0,0,0,0,0,0,Pick Your Own/U-Pick operation; ,0,0,0,0,1,0,0,0,0,0,0,Hand washing station(s); ,1,0,0,0,0,1,1,0,0
4000874,,2014-07-26 18:18:45,2014-07-26 18:18:45,3724 North County Road 13,Fort Collins ,Colorado,08,80524,Laughing Buck Farm,www.laughingbuckfarm.com,https://www.facebook.com/laughingbuckfarm,,,,,Eggs; Fresh vegetables; Soap;,,,,,,,,,,,,,0,0,0,0,0,0,0,0,1,0,0,0,1,0,0,0,0,0,0,0,0,0,0,0,1,0,0,0,Educational tours/ classes; Family/ youth activities;  ,0,1,0,1,0,0,0,0,0,0,0,,0,0,0,0,0,0,0,0,0
4003854,,2014-07-26 21:03:04,2014-07-26 21:03:04,2397 SE 37th Avenue,Trenton,Florida,12,32693,Laughing Chicken Farm,www.laughingchickenfarm.com,https://www.facebook.com/pages/Laughing-Chicken-Farm/108558185834354,,01/01/2014 to 12/31/2014,,,Pet food; Poultry products; Non-poultry meat;,,,,,,,,,,,,,0,0,0,0,0,0,0,0,0,0,0,0,0,0,0,0,0,0,0,0,1,1,0,1,0,0,0,0, Other: farm tours and instruction;,0,0,0,0,0,0,0,0,0,0,0,,0,0,0,0,1,1,1,0,0
4003650,,2014-09-30 10:52:26,2014-09-30 10:52:26,66 Wigwam Road,Litchfield,Connecticut,09,6759,Laurel Ridge Grass Fed Beef,www.lrgfb.com,,,01/01/2014 to 12/31/2014,Sun: 12:00 PM - 2:00 PM;,,Non-poultry meat;,,,,,,,,,,,,,0,0,0,0,0,0,0,0,0,0,0,0,0,0,0,0,0,0,0,0,0,0,0,1,0,0,0,0,,0,0,0,0,0,0,0,0,0,0,0,,0,0,0,0,1,1,1,0,0
4000130,,2014-07-31 18:00:36,2014-07-31 18:00:36,"1219 Morris Dr. (lower level, rear)",Niles,Michigan,26,49120,"Lavender Hill Farm of Niles, MI LLC",www.thelavenderhill.com,https://www.facebook.com/thelavenderhill,,04/01/2014 to 05/31/2014,Fri: 10:00 AM - 4:00 PM;Sat: 10:00 AM - 4:00 PM;,Also open by appointment.,Honey; Nursery stock; Soap;,06/01/2014 to 08/31/2014,Mon: 10:00 AM - 4:00 PM;Tue: 10:00 AM - 4:00 PM;Wed: 10:00 AM - 4:00 PM;Thu: 10:00 AM - 4:00 PM;Fri: 10:00 AM - 4:00 PM;Sat: 10:00 AM - 4:00 PM;Sun:  - 4:00 PM;,"Also available by appointment. Special evening hours during mid-June to mid-July lavender season, check website.",Cut flowers; Honey;,09/01/2014 to 12/21/2014,Fri: 10:00 AM - 4:00 PM;Sat: 10:00 AM - 4:00 PM;,,Honey; Nursery stock;,,,,,0,0,0,0,0,1,0,0,0,0,0,0,0,0,1,0,0,0,1,0,0,0,0,0,1,0,0,0,Pick Your Own/U-Pick operation; ,0,0,0,0,1,0,0,0,0,0,0,Hand washing station(s); Picnic areas without tables; ,1,0,1,0,0,1,1,1,0
4000872,,2014-07-30 12:48:00,2014-07-30 12:48:00,2530 Darst Rd.,Coupeville,Washington,53,98239,Lavender Wind Farm,http://www.lavenderwind.com,https://www.facebook.com/LavenderWindFarm,,05/26/2014 to 09/01/2014,Mon: 10:00 AM - 5:00 PM;Tue: 10:00 AM - 5:00 PM;Wed: 10:00 AM - 5:00 PM;Thu: 10:00 AM - 5:00 PM;Fri: 10:00 AM - 5:00 PM;Sat: 10:00 AM - 5:00 PM;Sun: 10:00 AM - 5:00 PM;,,Baked goods; Canned or preserved food; Cut flowers; Honey; Nursery stock; Soap;,,,,,,,,,,,,,1,0,1,0,0,1,0,0,0,0,0,0,0,0,1,0,0,0,1,0,0,0,0,0,1,0,0,0,Pick Your Own/U-Pick operation; Tours of manufacturing facilities; ,0,0,0,0,1,1,0,0,0,0,0,Picnic areas with tables; ,0,0,0,1,0,1,1,1,0
4017203,2014-08-20 12:04:51,2014-08-20 12:15:44,2014-08-20 12:15:44,2634 Smeltzer Rd,Marion,Ohio,39,43302,Lawrence Orchards,www.lawrenceorchards.com,https://www.facebook.com/LawrenceOrchards?ref=hl,,06/20/2014 to 12/24/2014,Mon: 9:00 AM - 5:00 PM;Tue: 9:00 AM - 5:00 PM;Wed: 9:00 AM - 5:00 PM;Thu: 9:00 AM - 5:00 PM;Fri: 9:00 AM - 5:00 PM;Sat: 9:00 AM - 5:00 PM;,,Baked goods; Canned or preserved food; Crafts and/or woodworking items; Cut flowers; Dairy products; Fresh fruits; Fresh vegetables; Grains and/or flour; Honey; Juices; Maple products; Nuts; Prepared foods;,,,,,,,,,,,,,1,0,1,0,1,1,1,0,0,0,0,1,1,1,1,1,1,0,0,1,0,0,1,0,0,0,0,0,"Celebrations/ corporate events; Educational tours/ classes; Farm meals (lunches, dinners, etc.); Family/ youth activities;  Pick Your Own/U-Pick operation; Tours of manufacturing facilities; Hay rides; Corn maze; Petting zoo; Pony rides; ",1,1,1,1,1,1,0,1,1,1,1,Hand washing station(s); Flush toilets; Picnic areas with tables; ,1,1,0,1,0,1,1,1,0
4017439,2014-09-12 21:35:33,2014-09-12 21:44:54,2014-09-12 21:44:54,5165 E US Highway 40,Plainfield ,Indiana,18,46168,Lazy A Ranch,,,,06/01/2015 to 10/01/2015,Tue: 10:00 AM - 6:00 PM;Wed: 10:00 AM - 3:00 PM;Thu: 10:00 AM - 6:00 PM;Fri: 10:00 AM - 6:00 PM;Sat: 10:00 AM - 6:00 PM;,,Cut flowers; Eggs; Herbs; Fresh vegetables; Honey;,,,,,,,,,,,,,0,0,0,0,0,1,0,0,1,0,1,0,1,0,1,0,0,0,0,0,0,0,0,0,0,0,0,0,,0,0,0,0,0,0,0,0,0,0,0,,0,0,0,0,1,1,0,0,0
4017222,2014-08-21 18:08:30,2014-08-21 18:17:27,2014-08-21 18:17:27,9000 Cascade Road,Rochester,Illinois,17,62563,Lazy J Ranch,,https://www.facebook.com/pages/Lazy-J-Ranch-Rochester-IL/170348153012473,,03/01/2014 to 11/01/2014,,Open for business all year round.  Taking orders all year round.,,,,,,,,,,,,,,0,0,0,0,0,0,0,0,0,0,0,0,0,0,0,0,0,0,0,0,0,0,0,0,0,0,0,0,"Farm meals (lunches, dinners, etc.); Hay rides; ",0,0,1,0,0,0,0,1,0,0,0,,0,0,0,0,1,1,1,0,0
4013184,,2014-07-26 21:42:15,2014-07-26 21:42:15,2763 Caniehead Rd,Campbellton,Florida,12,32416,LE Farms LLC,www.chestnutsrus.com,,,09/01/2014 to 10/31/2014,Mon: 2:00 PM - 6:00 PM;Tue: 2:00 PM - 6:00 PM;Wed: 2:00 PM - 6:00 PM;Thu: 2:00 PM - 6:00 PM;Fri: 2:00 PM - 6:00 PM;Sat: 2:00 PM - 6:00 PM;Sun: 2:00 PM - 6:00 PM;,Call 850 566 7902 if alternate arrangements are needed.,Nuts;,,,,,,,,,,,,,0,0,0,0,0,0,0,0,0,0,0,0,0,0,0,0,0,0,0,1,0,0,0,0,0,0,0,0,Pick Your Own/U-Pick operation; ,0,0,0,0,1,0,0,0,0,0,0,Hand washing station(s); Flush toilets; ,1,1,0,0,0,1,1,0,0
4017225,2014-08-21 21:14:51,2014-08-21 21:24:53,2014-08-21 21:24:53,270 MONROE RD.,Hattiesburg ,Mississippi,28,39401,LEAF RIVER HONEY,,https://www.facebook.com/#!/LeafRiverHoney,,01/01/2014 to 12/31/2014,,BEST TO CALL FIRST.,Honey;,,,,,,,,,,,,,0,0,0,0,0,0,0,0,0,0,0,0,0,0,1,0,0,0,0,0,0,0,0,0,0,0,0,0,,0,0,0,0,0,0,0,0,0,0,0,,0,0,0,0,1,1,1,0,0
4014258,,2014-08-13 12:03:24,2014-08-13 12:03:24,3800 Newbys Bridge Road ,Chesterfield,Virginia,51,23832,Leaning Oak Farm ,,,,01/01/2014 to 12/31/2014,,,Cut flowers; Fresh fruits; Fresh vegetables;,,,,,,,,,,,,,0,0,0,0,0,1,0,0,0,0,0,1,1,0,0,0,0,0,0,0,0,0,0,0,0,0,0,0,Pick Your Own/U-Pick operation; ,0,0,0,0,1,0,0,0,0,0,0,,0,0,0,0,1,1,1,0,0
4017234,2014-08-22 09:21:10,2014-08-22 09:37:48,2014-08-22 09:37:48,1417 Sawyer Rd,Kent,New York,36,14477,Lee Farms,,https://www.facebook.com/Lee.Farms.Organic.Beef?ref=hl,,01/01/2014 to 12/31/2014,,Please call ahead - I am always working the farm or making deliveries and not always near the house,Eggs; Fresh vegetables; Non-poultry meat;,,,,,,,,,,,,,0,0,0,0,0,0,0,0,1,0,0,0,1,0,0,0,0,0,0,0,0,0,0,1,0,0,0,0,Educational tours/ classes; ,0,1,0,0,0,0,0,0,0,0,0,,0,0,0,0,0,1,1,0,1
4015246,,2014-07-26 19:26:04,2014-07-26 19:26:04,2297 Ethan Allen Highway (route 7),New Haven,Vermont,50,5472,Lester Farm and Market,contact@lesterfarmmarket.com,https://www.facebook.com/LesterFarmProduce,,06/12/2014 to 10/31/2014,Mon: 11:00 AM - 6:00 PM;Tue: 11:00 AM - 6:00 PM;Wed: 11:00 AM - 6:00 PM;Thu: 11:00 AM - 6:00 PM;Fri: 11:00 AM - 6:00 PM;Sat: 10:00 AM - 6:00 PM;Sun: 10:00 AM - 6:00 PM;,,Baked goods; Canned or preserved food; Cut flowers; Dairy products; Dry beans; Eggs; Herbs; Fresh fruits; Fresh vegetables; Grains and/or flour; Honey; Maple products; Nuts;,,,,,,,,,,,,,1,0,1,0,0,1,1,1,1,0,1,1,1,1,1,0,1,0,0,1,0,0,0,0,0,0,0,0,Educational tours/ classes; Hay rides; ,0,1,0,0,0,0,0,1,0,0,0,Picnic areas with tables; ,0,0,0,1,0,1,1,1,1
4015929,,2014-08-29 07:16:28,,4180 W. M-20 (stony Lake Road),New Era,Michigan,26,49446,Lewis Farm Market & Petting Farm,http://lewisfarmmarket.com/,https://www.facebook.com/LewisFarmMarket,,05/08/2014 to 11/02/2014,Mon: 9:00 AM - 6:00 PM;Tue: 9:00 AM - 6:00 PM;Wed: 9:00 AM - 6:00 PM;Thu: 9:00 AM - 6:00 PM;Fri: 9:00 AM - 6:00 PM;Sat: 9:00 AM - 6:00 PM;Sun: 10:00 AM - 5:00 PM;,Extended hours for special events.  Check calendar of events on website.,Baked goods; Canned or preserved food; Crafts and/or woodworking items; Dairy products; Fresh fruits; Fresh vegetables; Juices; Maple products; Prepared foods;,05/07/2015 to 11/01/2015,Mon: 9:00 AM - 6:00 PM;Tue: 9:00 AM - 6:00 PM;Wed: 9:00 AM - 6:00 PM;Thu: 9:00 AM - 6:00 PM;Fri: 9:00 AM - 6:00 PM;Sat: 9:00 AM - 6:00 PM;Sun: 10:00 AM - 5:00 PM;,Extended hours for special events.  Check calendar of events on website.,Baked goods; Canned or preserved food; Crafts and/or woodworking items; Dairy products; Fresh fruits; Fresh vegetables; Juices; Maple products; Prepared foods;,,,,,,,,,1,0,1,0,1,0,1,0,0,0,0,1,1,0,0,1,1,0,0,0,0,0,1,0,0,0,0,0,,,,,,,,,,,,,,,,,,,,,,
4003559,,2014-07-26 22:33:40,2014-07-26 22:33:40,86 Sawyer Mt. Road,Limerick,Maine,23,4048,Libby & Son U-Picks,www.libbysonupicks.com,,,07/01/2014 to 10/31/2014,,,Baked goods; Coffee and/or tea; Crafts and/or woodworking items; Fresh fruits; Honey; Juices; Maple products; Prepared foods;,,,,,,,,,,,,,1,0,0,1,1,0,0,0,0,0,0,1,0,0,1,1,1,0,0,0,0,0,1,0,0,0,0,0,Celebrations/ corporate events; Educational tours/ classes; Pick Your Own/U-Pick operation; Tours of manufacturing facilities;  Other: Live Music and shuttle rides;,1,1,0,0,1,1,0,0,0,0,0,Hand washing station(s); Flush toilets; Picnic areas with tables; ,1,1,0,1,0,1,1,0,0
4000861,,2014-08-13 17:32:15,2014-08-13 17:32:15,20014 SE 240th St,Maple Valley,Washington,53,98038,Liberty Alpacas,www.libertyalpacas.com,https://www.facebook.com/liberty.alpacas.3,,12/01/2014 to 12/31/2014,Sat: 10:00 AM - 4:00 PM;Sun: 10:00 AM - 4:00 PM;,,,,,,,,,,,,,,,0,0,0,0,0,0,0,0,0,0,0,0,0,0,0,0,0,0,0,0,0,0,0,0,0,0,0,0,Celebrations/ corporate events; Educational tours/ classes; Family/ youth activities;  ,1,1,0,1,0,0,0,0,0,0,0,,0,0,0,0,1,1,1,1,0
4015772,,2014-09-16 12:25:07,2014-09-16 12:25:07,8308 Kuhn Station Road,Edwardsville,Illinois,17,62025,Liberty Apple Orchard,www.libertyappleorchard.com,libertyappleorchard,,08/23/2014 to 11/09/2014,Tue: 3:00 PM - 5:00 PM;Thu: 3:00 PM - 5:00 PM;Sat: 1:00 PM - 5:00 PM;Sun: 1:00 PM - 4:30 PM;,,Fresh fruits;,,,,,,,,,,,,,0,0,0,0,0,0,0,0,0,0,0,1,0,0,0,0,0,0,0,0,0,0,0,0,0,0,0,0,Educational tours/ classes; Family/ youth activities;  Pick Your Own/U-Pick operation; ,0,1,0,1,1,0,0,0,0,0,0,Hand washing station(s); Picnic areas without tables; ,1,0,1,0,0,1,1,0,0
