OF_ID,createTime,updateTime,finishTime,Location_ST,Location_City,Location_State,Location_StateFIPS,Location_Zip,marketname,Market_Website,Market_Facebook,Market_Twitter,season1_date,season1_time,season1_notes,season1_products,season2_date,season2_time,season2_notes,season2_products,season3_date,season3_time,season3_notes,season3_products,season4_date,season4_time,season4_notes,season4_products,Product_1,Product_2,Product_3,Product_4,Product_5,Product_6,Product_7,Product_8,Product_9,Product_10,Product_11,Product_12,Product_13,Product_14,Product_15,Product_16,Product_17,Product_18,Product_19,Product_20,Product_21,Product_22,Product_23,Product_24,Product_25,Product_26,Product_27,Product_28,ActivityList,Activity_1,Activity_2,Activity_3,Activity_4,Activity_5,Activity_6,Activity_7,Activity_8,Activity_9,Activity_10,Activity_11,FacilitiesList,Facilities_1,Facilities_2,Facilities_3,Facilities_4,Facilities_5,Payment_2,Payment_3,Payment_4,Payment_1
4003179,,2014-07-26 18:02:55,2014-07-26 18:02:55,5488 Kinsman Rd (SR 87),Middlefield,Ohio,39,44062,Ridgeview Farm,www.ridgeviewfarm.com,https://www.facebook.com/pages/Ridgeview-Farm-and-Tours/118515271492395,,06/02/2014 to 10/31/2014,Mon: 10:00 AM - 5:00 PM;Tue: 10:00 AM - 5:00 PM;Wed: 10:00 AM - 5:00 PM;Thu: 10:00 AM - 5:00 PM;Fri: 10:00 AM - 5:00 PM;Sat: 10:00 AM - 5:00 PM;,,Canned or preserved food; Fresh fruits; Fresh vegetables;,,,,,,,,,,,,,0,0,1,0,0,0,0,0,0,0,0,1,1,0,0,0,0,0,0,0,0,0,0,0,0,0,0,0,Educational tours/ classes; Family/ youth activities;  Pick Your Own/U-Pick operation; Hay rides; Corn maze; Petting zoo; ,0,1,0,1,1,0,0,1,1,1,0,Hand washing station(s); Picnic areas with tables; ,1,0,0,1,0,1,1,1,0
4000309,,2014-07-27 22:17:06,2014-07-27 22:17:06,173 Woodson Rd.,Lowesville,Virginia,51,22967,River Oak Farm,,https://www.facebook.com/riveroakfarm,,01/01/2014 to 12/31/2014,,Open by appointment,Eggs; Poultry products; Non-poultry meat;,,,,,,,,,,,,,0,0,0,0,0,0,0,0,1,0,0,0,0,0,0,0,0,0,0,0,0,1,0,1,0,0,0,0,,0,0,0,0,0,0,0,0,0,0,0,,0,0,0,0,1,1,1,1,0
4000308,,2014-07-30 17:52:42,2014-07-30 17:52:42,90322 Highway 42S,Coquille,Oregon,41,97423,River's Blessings LLC,,https://www.facebook.com/RiversBlessings,,01/01/2014 to 12/31/2014,Mon: 10:00 AM - 4:00 PM;Tue: 10:00 AM - 4:00 PM;Wed: 10:00 AM - 4:00 PM;Thu: 10:00 AM - 4:00 PM;Fri: 10:00 AM - 4:00 PM;Sat: 10:00 AM - 4:00 PM;,,Eggs;,,,,,,,,,,,,,0,0,0,0,0,0,0,0,1,0,0,0,0,0,0,0,0,0,0,0,0,0,0,0,0,0,0,0,,0,0,0,0,0,0,0,0,0,0,0,,0,0,0,0,1,1,1,0,0
4013962,,2014-08-06 11:23:16,2014-08-06 11:23:16,44 72nd Street,South Haven,Michigan,26,49090,Riverbend Farms,greatberries.net,,,07/01/2014 to 10/31/2014,Mon: 9:00 AM - 6:00 PM;Tue: 9:00 AM - 6:00 PM;Wed: 9:00 AM - 6:00 PM;Thu: 9:00 AM - 6:00 PM;Fri: 9:00 AM - 6:00 PM;Sat: 9:00 AM - 6:00 PM;Sun: 9:00 AM - 6:00 PM;,,Canned or preserved food; Fresh fruits; Maple products; Nuts;,,,,,,,,,,,,,0,0,1,0,0,0,0,0,0,0,0,1,0,0,0,0,1,0,0,1,0,0,0,0,0,0,0,0,Pick Your Own/U-Pick operation; ,0,0,0,0,1,0,0,0,0,0,0,Hand washing station(s); Flush toilets; Picnic areas without tables; ,1,1,1,0,0,1,1,1,0
4017176,2014-08-11 13:38:33,2014-08-11 13:46:05,2014-08-11 13:46:05,708 Thompson Road SE,Floyd,Virginia,51,24091,Riverstone Organic Farm Shop,www.riverstoneorganicfarm.com,www.facebook.com/riverstoneorganicfarm,,01/01/2014 to 12/31/2014,Sat: 10:00 AM - 3:00 PM;,,Canned or preserved food; Cut flowers; Herbs; Fresh fruits; Fresh vegetables; Mushrooms; Wild harvested forest products;,,,,,,,,,,,,,0,0,1,0,0,1,0,0,0,0,1,1,1,0,0,0,0,1,0,0,0,0,0,0,0,0,1,0,"Celebrations/ corporate events; Educational tours/ classes; Farm meals (lunches, dinners, etc.); Pick Your Own/U-Pick operation; ",1,1,1,0,1,0,0,0,0,0,0,Hand washing station(s); Flush toilets; Picnic areas without tables; Picnic areas with tables; ,1,1,1,1,0,1,1,1,0
4017370,2014-09-01 22:54:28,2014-09-02 09:49:24,2014-09-02 08:06:42,47 Jefferson St.,Tidioute,Pennsylvania,42,16351,Riverview Farms,http://www.riverviewfarmspa.com,,,01/01/2014 to 12/31/2014,,,,,,,,,,,,,,,,0,0,0,0,0,0,0,0,0,0,0,0,0,0,0,0,0,0,0,0,0,0,0,0,0,0,0,0,,0,0,0,0,0,0,0,0,0,0,0,,0,0,0,0,0,0,0,0,0
4014177,,2014-07-28 07:54:29,,11124 Monte Vista Road,Phelan,California,06,92371,Roaring L Ranch,,,,,,,,,,,,,,,,,,,,0,0,0,0,0,0,0,0,0,0,0,0,0,0,0,0,0,0,0,0,0,0,0,0,0,0,0,0,,,,,,,,,,,,,,,,,,,,,,
4012442,,2014-08-13 11:13:26,2014-08-13 11:13:26,1701 South Cherokee St,Denver,Colorado,08,80229,RoastedChile.com,Roastedchili.com,,,08/10/2014 to 11/13/2014,Mon: 9:00 AM - 7:00 PM;Tue: 9:00 AM - 7:00 PM;Wed: 9:00 AM - 7:00 PM;Thu: 9:00 AM - 7:00 PM;Fri: 9:00 AM - 7:00 PM;Sat: 9:00 AM - 7:00 PM;Sun: 9:00 AM - 7:00 PM;,May be open latter depending on traffic,Canned or preserved food; Dry beans; Honey; Nuts;,,,,,,,,,,,,,0,0,1,0,0,0,0,1,0,0,0,0,0,0,1,0,0,0,0,1,0,0,0,0,0,0,0,0,Educational tours/ classes; ,0,1,0,0,0,0,0,0,0,0,0,Hand washing station(s); ,1,0,0,0,0,1,0,1,0
4000305,,2014-09-16 15:02:50,2014-09-16 15:02:50,317 Houston Richard Road,Church Point,Louisiana,22,70525,Robin Farms,Www.robinfarms.com,https://www.facebook.com/Robinfarms,,09/22/2014 to 12/20/2014,Mon: 10:00 AM - 5:30 PM;Tue: 10:00 AM - 5:30 PM;Wed: 10:00 AM - 5:30 PM;Thu: 10:00 AM - 5:30 PM;Fri: 10:00 AM - 5:30 PM;Sat: 9:00 PM - 11:30 PM;,,Fresh fruits; Fresh vegetables;,05/01/2014 to 07/31/2014,Mon: 10:00 AM - 6:00 PM;Tue: 10:00 AM - 6:00 PM;Wed: 10:00 AM - 6:00 PM;Thu: 10:00 AM - 6:00 PM;Fri: 10:00 AM - 6:00 PM;Sat: 9:00 AM - 2:00 PM;,,Cut flowers; Fresh fruits; Fresh vegetables;,,,,,,,,,0,0,0,0,0,1,0,0,0,0,0,1,1,0,0,0,0,0,0,0,0,0,0,0,0,0,0,0,Educational tours/ classes; Family/ youth activities;  ,0,1,0,1,0,0,0,0,0,0,0,Hand washing station(s); Flush toilets; Picnic areas with tables; ,1,1,0,1,0,1,1,1,0
4017443,2014-09-14 11:59:47,2014-09-14 12:05:30,2014-09-14 12:05:30,67625 Mulberry Rd,Lakeville,Indiana,18,46536,Rock Icelandics,,Rock Icelandics and Suffolks,,,,by appt. only,Non-poultry meat;,,,,,,,,,,,,,0,0,0,0,0,0,0,0,0,0,0,0,0,0,0,0,0,0,0,0,0,0,0,1,0,0,0,0,,0,0,0,0,0,0,0,0,0,0,0,,0,0,0,0,0,1,1,0,0
4017259,2014-08-23 17:25:52,2014-08-23 17:51:46,2014-08-23 17:51:46,8435 Hwy 16,Westmoreland,Kansas,20,66549,Rockin J Farm,,,,01/01/2014 to 12/31/2014,Mon: 8:00 AM - 8:00 PM;Tue: 8:00 AM - 8:00 PM;Wed: 8:00 AM - 8:00 PM;Thu: 8:00 AM - 8:00 PM;Fri: 8:00 AM - 8:00 PM;Sat: 8:00 AM - 8:00 PM;Sun: 11:00 AM - 6:00 PM;,Ring Bell on side door,Baked goods; Eggs; Fresh vegetables;,,,,,,,,,,,,,1,0,0,0,0,0,0,0,1,0,0,0,1,0,0,0,0,0,0,0,0,0,0,0,0,0,0,0, Other: Kids can help collect eggs for their family;,0,0,0,0,0,0,0,0,0,0,0,Hand washing station(s); Flush toilets; Picnic areas with tables; ,1,1,0,1,0,1,1,1,0
4013935,,2014-09-17 08:58:44,2014-09-17 08:58:44,3736 Apulia Road,Jamesville,New York,36,13078,Rocking Horse Farm,www.rockinghorsefarmcny.com,Rocking Horse Farm,,09/19/2014 to 10/31/2014,Fri: 10:00 AM - 4:00 PM;Sat: 10:00 AM - 4:00 PM;,or by appointment - call 315-247-0122,Maple products;,11/28/2014 to 12/24/2014,Fri: 10:00 AM - 5:00 PM;Sat: 10:00 AM - 5:00 PM;Sun: 10:00 AM - 5:00 PM;,or by appointment - call 315-247-0122,Honey; Maple products;,,,,,,,,,0,0,0,0,0,0,0,0,0,0,0,0,0,0,1,0,1,0,0,0,0,0,0,0,0,0,0,0,Pick Your Own/U-Pick operation; Petting zoo; ,0,0,0,0,1,0,0,0,0,1,0,,0,0,0,0,1,1,0,1,0
4017555,2014-11-09 22:14:05,2014-11-10 09:41:51,2014-11-10 09:41:51,151 Hadsell rd,Warnerville ,New York,36,12187,Rocks and Roots Farm LLC,,,,05/18/2015 to 09/12/2015,,,Dairy products; Fresh vegetables; Honey; Mushrooms; Wild harvested forest products; Garlic ;,,,,,,,,,,,,,0,0,0,0,0,0,1,0,0,0,0,0,1,0,1,0,0,1,0,0,0,0,0,0,0,0,1,0,,0,0,0,0,0,0,0,0,0,0,0,,0,0,0,0,0,1,0,1,0
4000303,,2014-07-27 12:04:29,2014-07-27 12:04:29,201 Udall Road,Francestown,New Hampshire,33,03043,Rocky Meadow Farm,www.rockymeadowfarm.com,https://www.facebook.com/RockyMeadowFarm,,01/01/2014 to 12/31/2014,,,Non-poultry meat;,,,,,,,,,,,,,0,0,0,0,0,0,0,0,0,0,0,0,0,0,0,0,0,0,0,0,0,0,0,1,0,0,0,0,Educational tours/ classes; Tours of manufacturing facilities; ,0,1,0,0,0,1,0,0,0,0,0,Flush toilets; Picnic areas without tables; ,0,1,1,0,0,1,1,0,0
4000302,,2014-07-27 07:34:32,2014-07-27 07:34:32,130 Rocky Point Ave.,Warwick,Rhode Island,44,2889,Rocky Point Farm,www.rockypointblueberries.com,,,07/07/2014 to 08/17/2014,Mon: 7:00 AM - 12:00 PM;Tue: 7:00 AM - 12:00 PM;Wed: 7:00 AM - 12:00 PM;Thu: 7:00 AM - 12:00 PM;Fri: 7:00 AM - 12:00 PM;Sat: 7:00 AM - 12:00 PM;Sun: 7:00 AM - 12:00 PM;,We are also open on Thursday evenings from 4 pm - 8 pm,Canned or preserved food; Honey; Maple products;,09/27/2014 to 10/18/2014,Sat: 9:00 AM - 12:00 PM;Sun: 9:00 AM - 12:00 PM;,,Canned or preserved food; Honey; Maple products;,,,,,,,,,0,0,1,0,0,0,0,0,0,0,0,0,0,0,1,0,1,0,0,0,0,0,0,0,0,0,0,0,Pick Your Own/U-Pick operation; ,0,0,0,0,1,0,0,0,0,0,0,Hand washing station(s); Flush toilets; Picnic areas with tables; ,1,1,0,1,0,1,1,1,0
4017499,2014-10-03 15:50:18,2014-10-03 16:00:37,2014-10-03 16:00:37,4700 Canaan Church Road,Smyrna,South Carolina,45,29743,Roger Ridge Ranch,www.rogerridgeranch.com,www.facebook.com/rogerridgeranch,,01/01/2014 to 12/31/2014,Mon: 9:00 AM - 5:00 PM;Tue: 9:00 AM - 5:00 PM;Wed: 9:00 AM - 5:00 PM;Thu: 9:00 AM - 5:00 PM;Fri: 9:00 AM - 5:00 PM;Sat: 9:00 AM - 5:00 PM;,,Eggs; Poultry products; Non-poultry meat;,,,,,,,,,,,,,0,0,0,0,0,0,0,0,1,0,0,0,0,0,0,0,0,0,0,0,0,1,0,1,0,0,0,0,Celebrations/ corporate events; Educational tours/ classes; Family/ youth activities;  Tours of manufacturing facilities; Hay rides; Petting zoo; ,1,1,0,1,0,1,0,1,0,1,0,Hand washing station(s); Picnic areas without tables; Picnic areas with tables; ,1,0,1,1,0,1,0,0,0
4017160,2014-08-06 07:21:04,2014-08-06 07:26:00,2014-08-06 07:26:00,240 Southern Drive,Catawissa,Pennsylvania,42,17820,Rohrbach's Farm Market,rohrbachsfarm.net,https://www.facebook.com/pages/Rohrbachs-Farm-Market-Bakery-and-Gift-Shop/63601237131?ref=hl&ref_type=bookmark,,05/01/2014 to 12/31/2014,Mon: 9:00 AM - 5:00 PM;Tue: 9:00 AM - 5:00 PM;Wed: 9:00 AM - 5:00 PM;Thu: 9:00 AM - 5:00 PM;Fri: 9:00 AM - 5:00 PM;Sat: 9:00 AM - 5:00 PM;,Closed Sundays.  Extended hours in the summer and fall.,Baked goods; Canned or preserved food; Dairy products; Eggs; Fresh fruits; Fresh vegetables; Honey; Juices; Maple products; Prepared foods;,,,,,,,,,,,,,1,0,1,0,0,0,1,0,1,0,0,1,1,0,1,1,1,0,0,0,0,0,1,0,0,0,0,0,Educational tours/ classes; Family/ youth activities;  Pick Your Own/U-Pick operation; Hay rides; Corn maze;  Other: Summer Children's Educational Workshops;,0,1,0,1,1,0,0,1,1,0,0,Flush toilets; Picnic areas with tables; ,0,1,0,1,0,1,1,1,1
4004386,,2014-09-16 12:02:36,2014-09-16 12:02:36,4001 Deer Creek Road,Selma,Oregon,41,97538,Ronan Country Fibers,http://ronanfibers.com/,,,01/01/2014 to 12/31/2014,,Call to make an appointment.,Eggs; Poultry products; Non-poultry meat;,,,,,,,,,,,,,0,0,0,0,0,0,0,0,1,0,0,0,0,0,0,0,0,0,0,0,0,1,0,1,0,0,0,0,Educational tours/ classes; Family/ youth activities;  ,0,1,0,1,0,0,0,0,0,0,0,Flush toilets; ,0,1,0,0,0,1,1,0,0
4017451,2014-09-16 15:38:17,2014-09-18 12:47:08,2014-09-18 12:47:08,18409 nc 210 hwy,27501Angier ,North Carolina,37,,Ronnie's Berry Farm,ronniesberryfarm.com,ronnie's berry farm,,07/01/2014 to 08/30/2014,Wed: 8:00 AM - 1:00 PM;Fri: 8:00 AM - 1:00 PM;Sat: 8:00 AM - 1:00 PM;,call for additional times,Canned or preserved food; Fresh fruits; Honey;,09/01/2014 to 10/15/2014,Wed: 8:00 AM - 1:00 PM;Fri: 8:00 AM - 1:00 PM;Sat: 8:00 AM - 1:00 PM;,,Fresh fruits; Honey;,11/01/2014 to 12/31/2014,,call anytime for pecans,Nuts;,,,,,0,0,1,0,0,0,0,0,0,0,0,1,0,0,1,0,0,0,0,1,0,0,0,0,0,0,0,0,Pick Your Own/U-Pick operation; ,0,0,0,0,1,0,0,0,0,0,0,Flush toilets; Picnic areas without tables; ,0,1,1,0,0,1,1,0,0
4014308,,2014-07-30 13:24:50,2014-07-30 13:24:50,8611 47th Drive,Live Oak,Florida,12,32060,Rooney's Front Porch Farm,www.rooneyfarm.com,www.facebook.com/rooneysfarm,,05/30/2015 to 07/18/2015,Mon: 7:00 AM - 8:00 PM;Tue: 7:00 AM - 8:00 PM;Wed: 7:00 AM - 8:00 PM;Thu: 7:00 AM - 8:00 PM;Fri: 7:00 AM - 8:00 PM;Sat: 7:00 AM - 8:00 PM;Sun: 5:00 PM - 8:00 PM;,The berry ripening dictates our opening date.  Please refer to our web site for announcements.,Canned or preserved food; Fresh fruits;,,,,,,,,,,,,,0,0,1,0,0,0,0,0,0,0,0,1,0,0,0,0,0,0,0,0,0,0,0,0,0,0,0,0,Pick Your Own/U-Pick operation; ,0,0,0,0,1,0,0,0,0,0,0,Hand washing station(s); Picnic areas with tables; ,1,0,0,1,0,1,0,1,0
4000296,,2014-07-26 19:00:53,2014-07-26 19:00:53,3336 Columbus Rd.,Springfield,Ohio,39,45503,"Root Down Acres, LLC",www.RootDownAcres.com,https://www.facebook.com/rootdownacres,https://www.twitter.com/rootdownacres,,,,,,,,,,,,,,,,,0,0,0,0,0,0,0,0,0,0,0,0,0,0,0,0,0,0,0,0,0,0,0,0,0,0,0,0, Other: National Alpaca Farm Days;,0,0,0,0,0,0,0,0,0,0,0,,0,0,0,0,1,1,0,1,0
4000293,,2014-07-27 17:49:39,2014-07-27 17:49:39,63 Rosalie Road,Alexandria,Louisiana,22,71302,Rosalie Pecans,www.shop.rosaliepecans.com,https://www.facebook.com/rosaliepecans,,10/01/2014 to 12/31/2014,Mon: 10:00 AM - 6:00 PM;Tue: 10:00 AM - 6:00 PM;Wed: 10:00 AM - 6:00 PM;Thu: 10:00 AM - 6:00 PM;Fri: 10:00 AM - 6:00 PM;Sat: 10:00 AM - 2:00 PM;,During offseason (January through September) it's best to call first!,Nuts;,01/01/2014 to 09/30/2014,,During the off-season (January through September) it's best to call for an appointment!,Nuts;,,,,,,,,,0,0,0,0,0,0,0,0,0,0,0,0,0,0,0,0,0,0,0,1,0,0,0,0,0,0,0,0,,0,0,0,0,0,0,0,0,0,0,0,Hand washing station(s); Flush toilets; ,1,1,0,0,0,1,1,1,0
4016645,,2014-07-30 23:36:54,2014-07-30 23:36:54,8605 Kerrville-Rosemark,Millington,Tennessee,47,38053,Rosemark Vinyards,,,,,,,,,,,,,,,,,,,,0,0,0,0,0,0,0,0,0,0,0,0,0,0,0,0,0,0,0,0,0,0,0,0,0,0,0,0,Pick Your Own/U-Pick operation; ,0,0,0,0,1,0,0,0,0,0,0,,0,0,0,0,1,1,0,0,0
4013138,,2014-08-14 12:32:43,2014-08-14 12:32:43,960 Whitefield Road (route 142),Dalton,New Hampshire,33,3598,RoseMartin Farms,,,,01/01/2014 to 12/31/2014,Tue: 10:00 AM - 5:00 PM;Wed: 10:00 AM - 5:00 PM;Thu: 10:00 AM - 5:00 PM;Fri: 10:00 AM - 5:00 PM;Sat: 10:00 AM - 5:00 PM;Sun: 10:00 AM - 5:00 PM;,closed mondays,Fresh vegetables;,,,,,,,,,,,,,0,0,0,0,0,0,0,0,0,0,0,0,1,0,0,0,0,0,0,0,0,0,0,0,0,0,0,0,,0,0,0,0,0,0,0,0,0,0,0,,0,0,0,0,1,1,0,0,0
4013910,,2014-07-27 13:34:26,2014-07-27 13:34:26, District #5 Road,Concord,New Hampshire,33,03303,Rossview Farm,www.rossviewfarm.com,,,06/10/2014 to 07/14/2014,,It is always best to call to get the most up to date hours of operation!,,07/10/2014 to 08/28/2014,,It is always best to call to get the most up to date hours of operation!,,09/19/2014 to 10/31/2014,,It is always best to call to get the most up to date hours of operation!,,11/28/2014 to 12/21/2014,,It is always best to call to get the most up to date hours of operation!,,0,0,0,0,0,0,0,0,0,0,0,0,0,0,0,0,0,0,0,0,0,0,0,0,0,0,0,0,Pick Your Own/U-Pick operation; Tours of manufacturing facilities; ,0,0,0,0,1,1,0,0,0,0,0,Picnic areas without tables; ,0,0,1,0,0,1,1,0,0
4013817,,2014-07-26 19:01:02,2014-07-26 19:01:02,15908 Hebron Road,Harvard,Illinois,17,60033,Royal Oak Farm Orchard,http://www.royaloakfarmorchard.com/,https://www.facebook.com/royaloakfarmorchard,https://twitter.com/RoyalOakFarmIL,08/22/2014 to 11/15/2014,Mon: 9:30 AM - 5:00 PM;Tue: 9:30 AM - 5:00 PM;Wed: 9:30 AM - 5:00 PM;Thu: 9:30 AM - 5:00 PM;Fri: 9:30 AM - 7:00 PM;Sat: 9:30 AM - 7:00 PM;Sun: 11:00 AM - 6:00 PM;,8/22 to 8/29 close at 5:00 PM and 11/1 to 11/15 close at 4:00 PM each day and closed all day Sunday.,Baked goods; Canned or preserved food; Coffee and/or tea; Crafts and/or woodworking items; Fresh fruits; Honey; Juices; Maple products; Nursery stock; Nuts; Prepared foods;,04/12/2014 to 08/16/2014,Sat: 10:00 AM - 1:00 PM;,Saturdays only from 10:00 AM to 1:00 PM  Weekdays by appointment only.  Closed Sundays.,Nursery stock;,,,,,,,,,1,0,1,1,1,0,0,0,0,0,0,1,0,0,1,1,1,0,1,1,0,0,1,0,0,0,0,0,"Celebrations/ corporate events; Educational tours/ classes; Farm meals (lunches, dinners, etc.); Family/ youth activities;  Pick Your Own/U-Pick operation; Tours of manufacturing facilities; Hay rides; Petting zoo;  Other: 14 horse carousel, Wattman Trackless Train, Apple Tree Maze, Playground;",1,1,1,1,1,1,0,1,0,1,0,Hand washing station(s); Flush toilets; ,1,1,0,0,0,1,1,1,0
4013026,,2014-07-29 15:52:13,2014-07-29 15:52:13,1057 County Road 2732,Alto,Texas,48,75925,Ruby-Farm,ruby-farm.com,,,01/01/2014 to 12/31/2014,Mon: 8:00 AM - 5:00 PM;Tue: 8:00 AM - 5:00 PM;Wed: 8:00 AM - 5:00 PM;Thu: 8:00 AM - 5:00 PM;Fri: 8:00 AM - 5:00 PM;Sat: 8:00 AM - 5:00 PM;Sun: 2:00 PM - 6:00 PM;,,Canned or preserved food; Fresh vegetables;,,,,,,,,,,,,,0,0,1,0,0,0,0,0,0,0,0,0,1,0,0,0,0,0,0,0,0,0,0,0,0,0,0,0,Pick Your Own/U-Pick operation; ,0,0,0,0,1,0,0,0,0,0,0,Hand washing station(s); Flush toilets; Picnic areas without tables; ,1,1,1,0,0,1,1,0,0
4017404,2014-09-08 12:06:40,2014-09-08 12:49:56,2014-09-08 12:49:56,1022 State Route 43,Mogadore,Ohio,39,44260,Rufener Hilltop Farms,rufeners.com,,,04/01/2014 to 11/01/2014,Mon: 9:00 AM - 7:00 PM;Tue: 9:00 AM - 7:00 PM;Wed: 9:00 AM - 7:00 PM;Thu: 9:00 AM - 7:00 PM;Fri: 9:00 AM - 7:00 PM;Sat: 9:00 AM - 7:00 PM;Sun: 10:00 AM - 5:00 PM;,,Baked goods; Bedding plants; Canned or preserved food; Eggs; Fresh fruits; Fresh vegetables; Honey; Maple products;,,,,,,,,,,,,,1,1,1,0,0,0,0,0,1,0,0,1,1,0,1,0,1,0,0,0,0,0,0,0,0,0,0,0,Hay rides; Corn maze; Petting zoo;  Other: Fall School Field Trips;,0,0,0,0,0,0,0,1,1,1,0,,0,0,0,0,0,1,1,1,1
4013167,,2014-09-16 11:38:10,,2942 Elder Road Ne,Lancaster,Ohio,39,43130,Ruffwing Farms,www.ruffwingfarms.com,,,,,,,,,,,,,,,,,,,0,0,0,0,0,0,0,0,0,0,0,0,0,0,0,0,0,0,0,0,0,0,0,0,0,0,0,0,,,,,,,,,,,,,,,,,,,,,,
4013893,,2014-07-27 07:30:54,2014-07-27 07:30:54,576 Northwest Road Route 132,Canterbury,New Hampshire,33,3224,Running Fox Farm,www.runningfoxfarmnh.com,https://www.facebook.com/running.f.farm,,05/24/2014 to 12/21/2014,Sat: 10:00 AM - 3:00 PM;Sun: 10:00 AM - 2:00 PM;,,Baked goods; Bedding plants; Canned or preserved food; Cut flowers; Dairy products; Fresh vegetables; Honey; Maple products; Pet food; Poultry products; Soap; Wine;,,,,,,,,,,,,,1,1,1,0,0,1,1,0,0,0,0,0,1,0,1,0,1,0,0,0,1,1,0,0,1,0,0,1,Educational tours/ classes; ,0,1,0,0,0,0,0,0,0,0,0,Picnic areas with tables; ,0,0,0,1,0,1,1,1,0
4017292,2014-08-25 17:22:16,2014-08-25 17:38:19,2014-08-25 17:38:19,N301 County Rd. H / PO Box H,Palmyra,Wisconsin,55,53156,"Rushing Waters Fisheries, LLC",www.rushingwaters.net,,,,Mon: 8:00 AM - 5:00 PM;Tue: 8:00 AM - 5:00 PM;Wed: 8:00 AM - 9:00 PM;Thu: 8:00 AM - 9:00 PM;Fri: 8:00 AM - 9:00 PM;Sat: 9:00 AM - 9:00 PM;Sun: 9:00 AM - 5:00 PM;,,Canned or preserved food; Crafts and/or woodworking items; Dairy products; Fish and/or seafood; Juices; Maple products; Pet food; Prepared foods; Non-poultry meat; Wine;,,,,,,,,,,,,,0,0,1,0,1,0,1,0,0,1,0,0,0,0,0,1,1,0,0,0,1,0,1,1,0,0,0,1,"Educational tours/ classes; Farm meals (lunches, dinners, etc.);  Other: Fishing;",0,1,1,0,0,0,0,0,0,0,0,Hand washing station(s); Flush toilets; ,1,1,0,0,0,1,1,1,0
4014098,,2014-07-26 18:55:32,2014-07-26 18:55:32,289 Maple Street,Contoocook,New Hampshire,33,3229,Russells Blueberries,www.russellcertifiedorganic.com,https://www.facebook.com/pages/Russells-Organic-Blueberries/115364307642,,,Mon: 8:00 AM - 5:00 PM;Tue: 8:00 AM - 5:00 PM;Wed: 8:00 AM - 5:00 PM;Thu: 8:00 AM - 5:00 PM;Fri: 8:00 AM - 5:00 PM;Sat: 8:00 AM - 5:00 PM;Sun: 8:00 AM - 5:00 PM;,Not open if it's raining.,Bedding plants; Cut flowers; Fresh fruits; Honey; Maple products;,,,,,,,,,,,,,0,1,0,0,0,1,0,0,0,0,0,1,0,0,1,0,1,0,0,0,0,0,0,0,0,0,0,0,Pick Your Own/U-Pick operation; ,0,0,0,0,1,0,0,0,0,0,0,Hand washing station(s); Picnic areas without tables; ,1,0,1,0,0,1,1,0,0
4013889,,2014-12-06 18:06:03,2014-12-06 18:06:03,23206 SE 448th Street,Enumclaw,Washington,53,98022,Rusty Plow Farm,www.rustyplowfarm.com,Facebook: The Rusty Plow Farm,,07/01/2015 to 08/31/2015,Tue: 8:00 AM - 5:00 PM;Wed: 8:00 AM - 5:00 PM;Thu: 8:00 AM - 5:00 PM;Fri: 8:00 AM - 7:00 PM;Sat: 8:00 AM - 5:00 PM;Sun: 11:00 AM - 4:00 PM;,Please check our Facebook or Website Pages prior to confirm our openings.  We occasionally close for ripening.,"Fresh fruits; Blueberry Farm, U-Pick or We-Pick;",,,,,,,,,,,,,0,0,0,0,0,0,0,0,0,0,0,1,0,0,0,0,0,0,0,0,0,0,0,0,0,0,0,0,Pick Your Own/U-Pick operation; ,0,0,0,0,1,0,0,0,0,0,0,Hand washing station(s); ,1,0,0,0,0,1,1,1,0
4017432,2014-09-12 14:47:20,2014-09-12 14:57:03,2014-09-12 14:57:03,301 Nelson Road,Iron River,Michigan,26,49935,S&C Nelson Farm,,,,01/01/2014 to 12/31/2014,,,,,,,,,,,,,,,,0,0,0,0,0,0,0,0,0,0,0,0,0,0,0,0,0,0,0,0,0,0,0,0,0,0,0,0,,0,0,0,0,0,0,0,0,0,0,0,,0,0,0,0,1,1,1,0,0
4000282,,2014-07-28 10:35:18,2014-07-28 10:35:18,10208 Jamesons Mill Road,Culpeper,Virginia,51,22701,Saddle Ridge Farm,http://www.saddleridgefarm.net/,https://www.facebook.com/saddleridgefarm,https://twitter.com/Saddleridgefarm,01/01/2014 to 12/31/2014,Mon: 9:00 AM - 6:00 PM;Tue: 9:00 AM - 6:00 PM;Wed: 9:00 AM - 6:00 PM;Thu: 9:00 AM - 6:00 PM;Fri: 9:00 AM - 6:00 PM;Sat: 9:00 AM - 6:00 PM;Sun: 9:00 AM - 6:00 PM;,Please call to shop by appointment,Poultry products; Non-poultry meat;,,,,,,,,,,,,,0,0,0,0,0,0,0,0,0,0,0,0,0,0,0,0,0,0,0,0,0,1,0,1,0,0,0,0,Celebrations/ corporate events; Educational tours/ classes; ,1,1,0,0,0,0,0,0,0,0,0,,0,0,0,0,0,1,1,1,0
4013862,,2014-10-06 09:57:28,,12414 191st Street East,Hastings,Minnesota,27,50033,Sam Kedem Nursery and Gardens,www.kedemgarden.com,,,,,,Nursery stock;,,,,,,,,,,,,,0,0,0,0,0,0,0,0,0,0,0,0,0,0,0,0,0,0,1,0,0,0,0,0,0,0,0,0,,0,0,0,0,0,0,0,0,0,0,0,,0,0,0,0,0,0,0,0,0
4013862,,2014-10-06 09:57:28,,12414 191st Street East,Hastings,Minnesota,27,50033,Sam Kedem Nursery and Gardens,www.kedemgarden.com,,,,,,Nursery stock;,,,,,,,,,,,,,0,0,0,0,0,0,0,0,0,0,0,0,0,0,0,0,0,0,1,0,0,0,0,0,0,0,0,0,,0,0,0,0,0,0,0,0,0,0,0,,0,0,0,0,0,0,0,0,0
4000278,,2014-07-30 12:22:01,2014-07-30 12:22:01,17790 96th St.,Live Oak,Florida,12,32060,Sampson Family Farm,sampsonfamilyfarm.com,https://www.facebook.com/sampsonfamilyfarm,,01/01/2014 to 12/31/2014,,"farm visits by appointment only, please call for a scheduled time",Pet food; Non-poultry meat;,,,,,,,,,,,,,0,0,0,0,0,0,0,0,0,0,0,0,0,0,0,0,0,0,0,0,1,0,0,1,0,0,0,0,,0,0,0,0,0,0,0,0,0,0,0,,0,0,0,0,1,1,1,0,0
4017139,2014-07-29 07:35:38,2014-07-29 07:44:06,2014-07-29 07:44:06,9211 Sloan Rd.,Mustang ,Oklahoma,40,73064,SandStone Spring Vineyard,,,,07/14/2014,Tue: 4:00 PM - 7:00 PM;Thu: 4:00 PM - 7:00 PM;Sun: 3:00 PM - 7:00 PM;,Call for an Appointment,Fresh fruits;,,,,,,,,,,,,,0,0,0,0,0,0,0,0,0,0,0,1,0,0,0,0,0,0,0,0,0,0,0,0,0,0,0,0,Educational tours/ classes; Pick Your Own/U-Pick operation; ,0,1,0,0,1,0,0,0,0,0,0,Hand washing station(s); ,1,0,0,0,0,1,0,0,0
4017294,2014-08-25 18:41:06,2014-08-25 18:55:55,2014-08-25 18:55:55,3380 Highway 33,Ventucopa,California,06,93252,Santa Barbara Pistachio Company,www.sbpistachios.com,https://www.facebook.com/pages/Santa-Barbara-Pistachio-Company/159650100721699,https://www.twitter.com/sbpistachios1,01/01/2014 to 12/31/2014,Mon: 8:00 AM - 6:00 PM;Tue: 8:00 AM - 6:00 PM;Wed: 8:00 AM - 6:00 PM;Thu: 8:00 AM - 6:00 PM;Fri: 8:00 AM - 6:00 PM;Sat: 8:00 AM - 6:00 PM;Sun: 8:00 AM - 6:00 PM;,,Eggs; Honey; Nuts; Soap;,,,,,,,,,,,,,0,0,0,0,0,0,0,0,1,0,0,0,0,0,1,0,0,0,0,1,0,0,0,0,1,0,0,0,Educational tours/ classes; ,0,1,0,0,0,0,0,0,0,0,0,Hand washing station(s); Flush toilets; Picnic areas with tables; ,1,1,0,1,0,1,0,1,0
4013853,,2014-09-29 09:00:14,2014-09-29 09:00:14,620 Towee Falls Road,Tellico Plains,Tennessee,47,37385,Santa's Berry Farm,,https://www.facebook.com/grampysanta?ref=hl,,06/14/2014 to 11/01/2014,Thu: 8:00 AM - 6:00 PM;Fri: 8:00 AM - 6:00 PM;Sat: 8:00 AM - 6:00 PM;Sun: 1:00 AM - 6:00 PM;,,Baked goods; Canned or preserved food; Coffee and/or tea; Crafts and/or woodworking items; Eggs; Fresh vegetables; Honey;,,,,,,,,,,,,,1,0,1,1,1,0,0,0,1,0,0,0,1,0,1,0,0,0,0,0,0,0,0,0,0,0,0,0,Educational tours/ classes; Family/ youth activities;  Pick Your Own/U-Pick operation; ,0,1,0,1,1,0,0,0,0,0,0,,0,0,0,0,0,1,1,0,0
4017332,2014-08-27 21:15:29,2014-09-29 16:13:05,2014-09-29 16:13:05,37013 State Highway 25 South,Malden ,Missouri,29,63863,Sara's Produce,,https://www.facebook.com/SarasProduce,,01/01/2014 to 12/31/2014,Mon: 10:00 AM - 6:00 PM;Tue: 10:00 AM - 6:00 PM;Wed: 10:00 AM - 6:00 PM;Thu: 10:00 AM - 6:00 PM;Fri: 10:00 AM - 6:00 PM;Sat: 9:00 AM - 6:00 PM;Sun: 1:00 PM - 5:00 PM;,,Canned or preserved food; Eggs; Fresh vegetables; Honey;,,,,,,,,,,,,,0,0,1,0,0,0,0,0,1,0,0,0,1,0,1,0,0,0,0,0,0,0,0,0,0,0,0,0,,0,0,0,0,0,0,0,0,0,0,0,,0,0,0,0,1,1,1,0,0
4003780,,2014-08-26 10:57:24,2014-08-26 10:57:24,W4192 Bristol Rd,Columbus,Wisconsin,55,53925,Sassy Cow Creamery,www.sassycowcreamery.com,https://www.facebook.com/pages/Sassy-Cow-Creamery/53518889031,,01/01/2014 to 12/31/2014,Mon: 10:00 AM - 7:00 PM;Tue: 10:00 AM - 7:00 PM;Wed: 10:00 AM - 7:00 PM;Thu: 10:00 AM - 7:00 PM;Fri: 10:00 AM - 7:00 PM;Sat: 9:00 AM - 6:00 PM;Sun: 11:00 AM - 6:00 PM;,,Baked goods; Coffee and/or tea; Dairy products; Grains and/or flour; Honey; Maple products; Nuts; Prepared foods; Non-poultry meat; Soap;,,,,,,,,,,,,,1,0,0,1,0,0,1,0,0,0,0,0,0,1,1,0,1,0,0,1,0,0,1,1,1,0,0,0,Educational tours/ classes; Tours of manufacturing facilities; ,0,1,0,0,0,1,0,0,0,0,0,Hand washing station(s); Flush toilets; Picnic areas with tables; ,1,1,0,1,0,1,1,1,0
4017515,2014-10-15 12:27:51,2014-10-15 13:31:07,2014-10-15 13:31:07,140 Edith Drive,Taylors,South Carolina,45,29687,Satterfield Farms,http://www.facebook.com/satterfieldgrassfedbeef,,,01/01/2014 to 12/31/2014,Tue: 2:00 PM - 6:00 PM;Fri: 2:00 PM - 6:00 PM;,Call (864) 444-1991 Anytime for information or appointments for other available hours.,,,,,,,,,,,,,,0,0,0,0,0,0,0,0,0,0,0,0,0,0,0,0,0,0,0,0,0,0,0,0,0,0,0,0,,0,0,0,0,0,0,0,0,0,0,0,,0,0,0,0,0,1,1,1,1
